Title,Date,URL,Article
Scientists unveil new strategy for cardiac arrest resuscitation,2024-10-18,http://en.people.cn/n3/2024/1018/c90000-20231071.html,"Home>>
		
Scientists unveil new strategy for cardiac arrest resuscitation
 (Xinhua) 10:45, October 18, 2024
GUANGZHOU, Oct. 17 (Xinhua) -- Researchers have developed a new method for cardiac arrest resuscitation, which is expected to improve the success rate of cardiopulmonary resuscitation and have a profound impact on the development of emergency care systems for critical conditions.
Cardiac arrest patients often experience severe brain damage, which is the primary cause of death. Animal studies have shown that within mere seconds of cardiac arrest, the brain's oxygen supply is depleted, leading to an immediate loss of consciousness.
Previous research suggested that the brain can only tolerate ischemic damage for five to eight minutes, which has contributed to the low resuscitation success rate for cardiac arrest patients.
An international research team led by He Xiaoshun from the first affiliated hospital, Sun Yat-sen University in south China's Guangdong Province, applied an innovative ""ex vivo brain preservation technique"" to successfully ""revive"" an isolated pig brain that had been ""dead"" for 50 minutes.
In detail, the study used a pig that had already experienced circulatory death as the experimental subject. After separating its brain from its body, the researchers connected the brain to an external life-support system through intubation, creating a system that supports brain resuscitation.
The results showed that the pig's brain was successfully ""revived,"" with brain functions restored and vitality maintained.
This system not only includes components for an artificial heart and artificial lungs but also utilizes normothermic blood perfusion technology to preserve a living pig liver, providing fresh, oxygenated and metabolically stable blood circulation to the isolated pig brain.
The study shows that with the support of the ex vivo life support system, the edema of the isolated brain was significantly reduced, and the vitality and microstructure of nerve cells were notably improved, allowing for the restoration and maintenance of electrical brain activity.
The study also highlights the crucial role of the liver in the pathogenesis of post-cardiac arrest brain injury.
The study was recently published as the cover article in the journal EMBO Molecular Medicine.
(Web editor: Zhang Kaiwei, Liang Jun)"
World's smallest dinosaur egg fossils discovered in China,2024-10-18,http://en.people.cn/n3/2024/1018/c90000-20230961.html,"Home>>
		
World's smallest dinosaur egg fossils discovered in China
 (Xinhua) 09:02, October 18, 2024

This undated file photo shows a new type of dinosaur egg fossils discovered in the city of Ganzhou, east China's Jiangxi Province. (China University of Geosciences (Wuhan)/Handout via Xinhua)
NANCHANG, Oct. 17 (Xinhua) -- Chinese researchers have discovered a new type of dinosaur egg fossils in east China's Jiangxi Province, with one measuring just 29 mm in length, the smallest ever found globally.
Following a three-year study, the team comprising researchers from the Jiangxi Geological Survey and Exploration Institute (JGSEI), China University of Geosciences (Wuhan) and the Institute of Vertebrate Paleontology and Paleoanthropology of the Chinese Academy of Sciences confirmed the six egg fossils dating back to the Late Cretaceous period, over 80 million years ago, as dinosaur eggs.
The relatively complete, irregularly arranged egg fossils were found in a well-preserved nest at a construction site in Meilin Township in Ganxian District in the city of Ganzhou in 2021.
Using scanning electron microscopy and electron backscatter diffraction, the team of researchers analyzed the microstructure of the eggshells, and determined that their morphology and microstructure suggest they belong to a non-avian theropod, said Lou Fasheng, chief engineer at the JGSEI.
The most complete egg has a maximum length of only 29 mm, setting a new record for the smallest dinosaur egg fossil, Lou said. The previously known smallest dinosaur egg fossil was found in China's Zhejiang Province, measuring approximately 45.5 mm X 40.4 mm X 34.4 mm in dimensions.
This latest discovery expands the diversity of dinosaur eggs from the Late Cretaceous and offers valuable insights into the evolution of theropods during that period, according to Lou.
The findings were published online on Monday in the journal Historical Biology.
Lou said the research team will use micro-CT scanning to reconstruct the burial state of the egg fossils, study their formation process and further pinpoint the dinosaur type that laid these eggs as well as the reproductive methods of the species.

This undated file photo shows a new type of dinosaur egg fossils discovered in the city of Ganzhou, east China's Jiangxi Province. (China University of Geosciences (Wuhan)/Handout via Xinhua)
(Web editor: Zhang Kaiwei, Zhong Wenxing)"
Tesla yet to receive regulatory green light for FSD in China,2024-10-18,http://en.people.cn/n3/2024/1018/c90000-20230914.html,"Home>>
		
Tesla yet to receive regulatory green light for FSD in China
By Cheng Yu (Chinadaily.com.cn) 08:32, October 18, 2024

This aerial photo taken on Aug 20, 2022, shows the Tesla Gigafactory in the Lingang new area of the China (Shanghai) Pilot Free Trade Zone in East China's Shanghai. (Photo/Xinhua)
Multiple sources told China Daily that Tesla Inc has yet to receive regulatory approval from Chinese authorities to launch its full self-driving or FSD functions in the country and is seeking permission to gather some data on its own to train its autonomous driving system.
The United States vehicle maker announced last month on the social platform that it expected to launch FSD in China in the first quarter of 2025.""The rollout progress is not expected to mirror the speed as the company itself planned,"" several sources close to the matter confirmed.
They said that the proposal is still pending from various Chinese authorities to evaluate in an all-round way, including technology, data safety, laws and regulations, as well as other relevant standards.
Though no official green light has been given as of now, the Chinese government will partially support its trial test of FSD functions in some cities, the sources day.
As data security has been a key obstacle to a full rollout of FSD, two people close to Tesla said that Musk has proposed directly accessing some non-sensitive video data to train its autonomous driving system.
He also proactively suggested that a dedicated government team could thoroughly assess this video data to ensure its security, one of the sources said.
Other people acknowledged the matter and said that Chinese authorities didn't give an immediate response to this request given the current rules and regulations.
According to the regulations of the Ministry of Natural Resources, automakers and developers of autonomous driving software should either apply for mapping licenses or ask a licensed company to collect, store, transform, and process geographic data.
Currently, foreign firms lack the qualifications to independently gather geographic data and must partner with local entities.
To comply, Tesla has stored all data collected by its Chinese vehicles in China since 2021 and is cooperating with local companies to collect data to support its driver assistant system.
(Web editor: Tian Yi, Zhong Wenxing)"
2024 World Intelligent Connected Vehicles Conference kicks off in Beijing,2024-10-18,http://en.people.cn/n3/2024/1018/c90000-20230868.html,"Home>>
		
2024 World Intelligent Connected Vehicles Conference kicks off in Beijing
 (Xinhua) 08:19, October 18, 2024

Visitors look at self-driving vehicles displayed during the 2024 World Intelligent Connected Vehicles Conference in Beijing, capital of China, Oct. 17, 2024. The 2024 World Intelligent Connected Vehicles Conference kicked off here Thursday, during which a series of activities will be staged to promote the coordinated development of intelligent connected vehicles and related fields. (Xinhua/Chen Zhonghao)

A staff member of Chinese automaker GAC Group debugs an electric sports car during the 2024 World Intelligent Connected Vehicles Conference in Beijing, capital of China, Oct. 17, 2024. The 2024 World Intelligent Connected Vehicles Conference kicked off here Thursday, during which a series of activities will be staged to promote the coordinated development of intelligent connected vehicles and related fields. (Xinhua/Chen Zhonghao)

This photo taken on Oct. 17, 2024 shows an automatic pilot sand table model of China's ride-hailing platform Didi Chuxing displayed during the 2024 World Intelligent Connected Vehicles Conference in Beijing, capital of China. The 2024 World Intelligent Connected Vehicles Conference kicked off here Thursday, during which a series of activities will be staged to promote the coordinated development of intelligent connected vehicles and related fields. (Xinhua/Chen Zhonghao)

People visit the exhibition booth of AITO, an NEV brand jointly developed by Huawei and Chongqing-based automaker Seres, during the 2024 World Intelligent Connected Vehicles Conference in Beijing, capital of China, Oct. 17, 2024. The 2024 World Intelligent Connected Vehicles Conference kicked off here Thursday, during which a series of activities will be staged to promote the coordinated development of intelligent connected vehicles and related fields. (Xinhua/Chen Zhonghao)

The 2024 World Intelligent Connected Vehicles Conference is opened in Beijing, capital of China, Oct. 17, 2024. The 2024 World Intelligent Connected Vehicles Conference kicked off here Thursday, during which a series of activities will be staged to promote the coordinated development of intelligent connected vehicles and related fields. (Xinhua/Chen Zhonghao)

Visitors are seen at the exhibition booth of FAW Toyota Motor Co., Ltd. during the 2024 World Intelligent Connected Vehicles Conference in Beijing, capital of China, Oct. 17, 2024. The 2024 World Intelligent Connected Vehicles Conference kicked off here Thursday, during which a series of activities will be staged to promote the coordinated development of intelligent connected vehicles and related fields. (Xinhua/Chen Zhonghao)

People visit the exhibition booth of China Telecom during the 2024 World Intelligent Connected Vehicles Conference in Beijing, capital of China, Oct. 17, 2024. The 2024 World Intelligent Connected Vehicles Conference kicked off here Thursday, during which a series of activities will be staged to promote the coordinated development of intelligent connected vehicles and related fields. (Xinhua/Chen Zhonghao)

This photo taken on Oct. 17, 2024 shows new energy vehicle model SU7 produced by Chinese tech firm Xiaomi displayed during the 2024 World Intelligent Connected Vehicles Conference in Beijing, capital of China. The 2024 World Intelligent Connected Vehicles Conference kicked off here Thursday, during which a series of activities will be staged to promote the coordinated development of intelligent connected vehicles and related fields. (Xinhua/Chen Zhonghao)
(Web editor: Zhang Kaiwei, Liang Jun)"
Chinese scientists develop technology for sustainable production of industrial chemicals,2024-10-17,http://en.people.cn/n3/2024/1017/c90000-20230829.html,"Home>>
		
Chinese scientists develop technology for sustainable production of industrial chemicals
 (Xinhua) 16:11, October 17, 2024
BEIJING, Oct. 17 (Xinhua) -- Chinese scientists have developed a technology for sustainable production of bio-based ethylene glycol (EG), an important bulk energy chemical, with a production capacity of 1,000 tonnes annually, marking a significant step in the green transformation of China's chemical industry chain.
This breakthrough will also support China's sustainable economic development and the realization of the nation's ""dual carbon"" goal, which refers to peaking its carbon dioxide emissions by 2030 and achieving carbon neutrality by 2060, according to Zheng Mingyuan, a researcher with the Dalian Institute of Chemical Physics (DICP) of the Chinese Academy of Sciences.
A research team from DICP and SinoSci Bio-EG (Zhengzhou) New Energy Technology Co., Ltd. successfully completed pilot testing of the biomass-to-bio-EG catalytic conversion technology at a scale of 1,000 tonnes annually, which passed evaluation by the China Petroleum and Chemical Industry Federation on Thursday.
EG, mainly used in the synthesis of polyester fibers, polyester bottles, antifreeze, coatings and pharmaceuticals, has an annual global consumption of over 30 million tonnes. China is a major producer and consumer of EG, with an annual consumption exceeding 20 million tonnes.
However, EG is primarily produced from petroleum or coal, which has disadvantages such as reliance on non-renewable resources, high carbon dioxide emissions, and high energy consumption. Therefore, the development of green and efficient EG production technologies is urgently needed, Zheng noted.
In 2008, the research team led by Zhang Tao, an academician at the CAS, pioneered the direct catalytic conversion of cellulose into EG at DICP, establishing a novel pathway for producing bio-based EG.
In the subsequent years, the team conducted systematic research focusing on fundamental understanding and industrial applications. They achieved significant progress in developing low-cost catalysts, investigating reaction mechanisms, converting raw materials and creating high-efficiency reaction systems.
In 2022, the team of researchers, in collaboration with SinoSci Bio-EG and other partners, built the world's first pilot facility for 1,000-tonne bio-EG production through catalysis in Puyang in central China's Henan Province. The team later carried out technological improvements for the project.
Zheng explained that the pilot facility employs the biomass feedstock of sugars derived from starch and corn stalks to produce EG through a highly selective catalytic reaction system, combined with an efficient product separation process. The entire process follows a green, low-carbon route.
With over 40 authorized invention patents, this technology boasts a comprehensive portfolio of independent intellectual property rights, according to Zheng.
The pilot operation has laid the foundation for the industrial application of the technology at a scale of 10,000 tonnes annually, Zheng said.
(Web editor: Zhang Kaiwei, Zhong Wenxing)"
