Title,Date,URL,Article
Chinese companies shine at MWC,2024-02-28,http://en.people.cn/n3/2024/0228/c90000-20138041.html,"Home>>
		
Chinese companies shine at MWC
By Ma Si (China Daily) 08:10, February 28, 2024

The SU7, produced by Chinese tech company Xiaomi Corp, is displayed on Monday at the Mobile World Congress 2024 in Barcelona, Spain. GAO JING / XINHUA
Chinese technology companies are in the limelight at the ongoing Mobile World Congress 2024, a major telecommunications industry event in Barcelona, Spain, as they showcase their latest innovations to explore new business opportunities and gain a wider presence in Europe and beyond.
The event, which runs from Monday to Thursday, has attracted more than 300 Chinese companies, almost twice as many as last year. The enterprises are displaying their latest products, from upgraded 5G portfolios and artificial intelligence-powered smartphones to smart cars and augmented-reality devices.
The robust participation underscores Chinese companies' willingness for global collaboration and their technological prowess in strategic industries, despite the increase in the United States' arbitrary tech sanctions on them, experts said.
According to the GSMA, an industry group representing the world's biggest mobile phone operators and the organizer of MWC 2024, Huawei is the largest exhibitor this year, and China Tele-com and Alipay have made their debuts at the show. Other leading Chinese tech companies that are participating include Xiaomi, Lenovo, Honor and ZTE.
Mats Granryd, director-general of the GSMA, said there is a need for companies to align with the challenges and opportunities. ""As connectivity brings us together, technology opens possibilities. … Together we are strong, and alone we are nobody,"" he said.
As 2024 marks the commercial launch of 5G-advanced, or 5G-A, technology, which is a crucial upgrade of the 5G network in functionality and coverage, Chinese telecom companies are moving to center stage.
 

A laptop with a transparent screen, a new product from Chinese personal computer manufacturer Lenovo, draws interest from visitors on Monday at the event. GAO JING / XINHUA
During this year's MWC, Huawei launched the world's first 5G-A intelligent core network to support more cutting-edge applications. According to Huawei, 5G-A can improve network performance tenfold. For instance, it can support a downlink speed of 10 gigabits per second, compared with the current 5G speed of 1 Gbps.
Li Peng, senior vice-president of Huawei, said, ""The combination of 5G-A, artificial intelligence and cloud computing will help nurture new growth drivers."" Li added that the technology can help address challenges that 5G cannot solve in certain application scenarios before the commercialization of 6G.
Eager to tap into the huge potential, China Mobile, the world's largest telecom carrier in terms of mobile subscribers, announced at the tech show that it will start deploying 5G-A commercial networks in more than 300 Chinese cities this year, which would make its scale the largest in the world.
Yang Jie, chairman of China Mobile, said the company has made progress in experimenting with new 5G-A applications. For instance, more than 4 million users in China are now using a new calling service that can support automatic translation and other AI functions during ultra-high-definition video calls.
Xiang Ligang, director-general of the Information Consumption Alliance, a telecommunications industry association in China, said the progress comes amid the country's unparalleled edge in 5G.
China has built the world's largest 5G network, which had more than 800 million mobile subscribers at the end of 2023, according to the Ministry of Industry and Information Technology.
 
Meanwhile, the country accounts for 42 percent of the global patents that are essential to 5G technology standards, the largest share in the world, the ministry added.
""Chinese companies' enthusiasm toward the MWC event highlights their commitment to globalization and to leveraging it as a window to demonstrate China's openness, cooperation and win-win opportunities to Europe and the world,"" Xiang said.
As artificial intelligence takes the world by storm, Chinese companies are also eager to bring AI to more devices. On the sidelines of the MWC, Honor unveiled its latest AI-powered smartphones, highlighting its ambition to make a big splash in the global high-end smartphone market this year.
Zhao Ming, CEO of Honor, said: ""We have more than 100 innovation laboratories, and have established cooperation with more than 200 telecom operators and distributors across the world. All of these resources will get us ready to expand our global presence.""
Frank Meng, chairman of US chip company Qualcomm's China branch, said, ""Chinese companies will be the first to popularize AI smartphones and push them into more markets, as they embrace high-end brand strategies and boast advantages in supply chains.""
US market consultancy International Data Corp predicted that 170 million next-generation AI smartphones will be shipped globally this year, representing almost 15 percent of total smartphone shipments and a huge jump from the roughly 51 million shipped in 2023.
(Web editor: Tian Yi, Liang Jun)"
"U.S. lunar lander to lose control, end mission in advance",2024-02-27,http://en.people.cn/n3/2024/0227/c90000-20138008.html,"Home>>
		
U.S. lunar lander to lose control, end mission in advance
 (Xinhua) 16:53, February 27, 2024
LOS ANGELES, Feb. 26 (Xinhua) -- U.S. company Intuitive Machines' first lunar lander Odysseus will lose control and end its mission earlier than expected on Tuesday morning, the company said on Monday.
The lander will lose communication with flight controllers in Huston due to its solar panels off work by early morning Tuesday. This will cut the mission short for two to three days from a week expected by NASA and other customers, according to U.S. media reports.
The uncrewed lander landed at the lunar South Pole last Thursday, marking the first American spacecraft to land on the lunar surface in more than 50 years.
Although the Odysseus touched down on the lunar surface, analysis of data by flight engineers showed the six-legged spacecraft tripped over its own feet during its final descent, said Intuitive Machines CEO Stephen Altemus. The spacecraft was believed to have caught one of its landing feet on the uneven lunar surface and came to rest sideways.
""Flight controllers intend to collect data until the lander's solar panels are no longer exposed to light. Based on Earth and Moon positioning, we believe flight controllers will continue to communicate with Odysseus until Tuesday morning,"" said the company.
After understanding the end-to-end communication requirements, Odysseus sent images from the lunar surface of its vertical descent to its Malapert A landing site, representing the furthest south any vehicle has been able to land on the Moon and establish communication with ground controllers, according to the company.
Odysseus carries NASA science and other commercial payloads to the Moon.
The last U.S. moon landing mission was made in December 1972, when Apollo 17 touched down on the lunar surface for the final mission of the Apollo Program.
(Web editor: Zhang Kaiwei, Zhong Wenxing)"
Robotaxis get green light for airport run,2024-02-27,http://en.people.cn/n3/2024/0227/c90000-20137665.html,"Home>>
		
Robotaxis get green light for airport run
By Fan Feifei (China Daily) 09:58, February 27, 2024

Baidu and Pony.ai's autonomous driving vehicles test on the street in Yizhuang in Beijing's southern suburb. [PHOTO/CHINA DAILY]
Beijing has granted permits to several robotaxi operators, including Baidu Inc and Pony.ai, allowing them to offer driverless vehicle services at Beijing Daxing International Airport, a key step indicating that the city has become the world's first capital to run autonomous passenger vehicles between urban areas and the airport.
Industry experts said the move marks a milestone in China's efforts to develop an intelligent transportation system, and will further bolster the commercial application of self-driving technology.
The approval, granted by the head office of Beijing High-Level Automated Driving Demonstration Area, allows these companies to provide self-driving vehicle services on 40-kilometer expressways connecting the international airport with Yizhuang in Beijing's Daxing district, as well as in some designated areas within the airport.
The permits come with the precondition that a safety inspector will sit behind the steering wheel and take manual control in case of an emergency.
The Beijing municipal government has unveiled plans to expand the scope of demonstration zones for high-level autonomous driving this year and promote the orderly launch of self-driving services in key areas such as airports, railway stations and urban roads.
""The approval is of great significance in further accelerating the commercialization of autonomous driving technology across the nation,"" said Zhang Xiang, a researcher at the Jiangxi New Energy Technology Institute, adding that other first-tier cities are likely to follow Beijing and allow the commercial operation of driverless vehicles at their airports in the future.
Zhang also called for more efforts to strengthen the construction of intelligent transportation infrastructure, such as 5G-enabled vehicle-to-everything, or V2X system, which supports communication between a vehicle and any entity that may affect or may be affected by the vehicle, in order to improve traffic efficiency and minimize accident risks.
Chen Zhuo, general manager of Baidu's self-driving business unit, said the company is concentrating on expanding its commercial robotaxi fleet.
Chen said Baidu's fully autonomous vehicles are currently operating in several cities including Beijing, Chongqing, Wuhan in Hubei province and Shenzhen in Guangdong province. The company plans to expand its fleet size and operation area, and build the world's largest fully driverless ride-hailing zone, he added.
Baidu's Apollo Go service has accumulated more than 4.1 million ride orders as of Sept 30. In the third quarter of last year, Apollo Go provided 821,000 rides, up 73 percent year-on-year. It has obtained more than 5,000 autonomous driving patents, with the total testing mileage of its self-driving vehicles exceeding 90 million kilometers.
A report released by global consultancy IHS Markit said the market size of China's self-driving taxi services is expected to surpass 1.3 trillion yuan ($180.6 billion) by 2030, accounting for 60 percent of the ride-hailing market nationwide.
China has introduced a series of policies to promote the development and commercialization of self-driving technology in recent years.
According to the Ministry of Industry and Information Technology, the country supports the commercial application of Level 3 and above autonomous driving systems. Level 3, or L3, means conditional automation, which allows a vehicle to drive by itself without human override under certain conditions.
Lyu Jinghong, an analyst of intelligent mobility at research company BloombergNEF, said the permits to operate robotaxi services between Daxing international airport and Yizhuang will further boost the testing and application scenarios of self-driving cars, especially on routes between transportation hubs and urban roads.
According to BloombergNEF's Electric Vehicle Outlook, China will operate the world's largest robotaxi fleet with about 12 million self-driving vehicles by 2040, followed by the United States with around 7 million such vehicles.
(Web editor: Tian Yi, Zhong Wenxing)"
Tang Hongbo becomes Chinese astronaut with longest spaceflight time,2024-02-27,http://en.people.cn/n3/2024/0227/c90000-20137611.html,"Home>>
		
Tang Hongbo becomes Chinese astronaut with longest spaceflight time
 (Xinhua) 09:26, February 27, 2024

This screen image captured at Beijing Aerospace Control Center on Dec. 21, 2023 shows Shenzhou-17 astronaut Tang Hongbo (L) opening the hatch of space station lab module Wentian's airlock cabin. (Xinhua/Li Jie)
BEIJING, Feb. 26 (Xinhua) -- Tang Hongbo, a crew member on China's space station, has become the Chinese astronaut with the most spaceflight time, with a total of 215 days in orbit as of Monday.
Tang was launched into space via the Shenzhou-17 spaceship, together with Tang Shengjie and Jiang Xinlin, on Oct. 26, 2023.
He completed a 92-day manned mission in 2021 via the Shenzhou-12 spaceship.
Of the 20 Chinese astronauts on the country's space missions, Jing Haipeng and Chen Dong have also racked up in-orbit stays of more than 200 days.
(Web editor: Zhang Kaiwei, Zhong Wenxing)"
