Title,Date,URL,Article
"China, ASEAN members establish durian sci-tech innovation alliance",2024-07-22,http://en.people.cn/n3/2024/0722/c90000-20196311.html,"Home>>
		
China, ASEAN members establish durian sci-tech innovation alliance
 (Xinhua) 10:20, July 22, 2024
HAIKOU, July 21 (Xinhua) -- China has promoted sci-tech innovation and international cooperation in the durian industry by establishing an alliance between the Hainan Academy of Agricultural Sciences (HNAAS) and major durian industry associations in ASEAN member states on Saturday.
China-ASEAN Durian Science and Technology Innovation Alliance aims to establish an open, inclusive and mutually beneficial sci-tech innovation platform, and promote cooperation between China and ASEAN on durian planting technology, variety improvement technology, deep processing technology and industrial chain innovation.
Liu Zuokai, secretary of the leading Party members group of HNAAS, said the alliance will help China and ASEAN member states to leverage their regional industrial advantages and play an active role in collaborative research and innovation, production and processing, personnel training, and consumer market promotion.
The alliance was established at the 2024 China-ASEAN Durian Industry Seminar, held from July 19 to 21 in Sanya, south China's Hainan Province.
Hainan in 2019 undertook the large-scale trial planting of durian seedlings, and Sanya in 2023 saw its durian output hit approximately 50 tonnes, marking the first batch of domestically planted durians harvested on a large scale. This year, the durian planting area in Hainan has grown to nearly 40,000 mu (about 2,667 hectares) with output expected to reach 250 tonnes.
(Web editor: Zhang Kaiwei, Zhong Wenxing)"
China launches scientific expedition to river headwaters,2024-07-22,http://en.people.cn/n3/2024/0722/c90000-20196248.html,"Home>>
		
China launches scientific expedition to river headwaters
 (Xinhua) 09:32, July 22, 2024

Han Cheng (R), a member of a scientific expedition team of the Changjiang River Scientific Research Institute, collects water sample at Zhimenda hydrologic station in Yushu Tibetan Autonomous Prefecture of northwest China's Qinghai Province, July 20, 2024. Chinese scientists launched an expedition on Saturday in the headwater regions of the Yangtze and Lancang rivers in northwest China's Qinghai Province, to investigate the regions' water resources and ecological environment. The expedition will conduct scientific investigations into the water resources, river hydrology, water ecology, glaciers, soil erosion and permafrost of the regions. (Xinhua/Wu Zhizun)
XINING, July 20 (Xinhua) -- Chinese scientists embarked on an expedition on Saturday to investigate the water resources and ecological environment in the headwater regions of the Yangtze and Lancang rivers.
The expedition, comprising around 20 members, will carry out scientific investigations into river hydrology, water ecology, soil erosion, glaciers and permafrost in northwest China's Qinghai Province.
Key research projects include estimating the carbon stock of wetlands, assessing the impacts of permafrost thawing on the plateau, and measuring the thickness of permafrost on glaciers.
The field expedition is jointly organized by the Changjiang River Scientific Research Institute (CRSRI) of the Changjiang Water Resources Commission, along with other organizations. It is set to last 10 days.
It will further the understanding of the current state of the ecological environment in the headwater regions of the two rivers, and will provide basic data for research projects including the protection of the Yangtze River and the construction of Sanjiangyuan National Park, said the CRSRI's chief engineer Xu Ping.
Qinghai is home to the Sanjiangyuan area, which contains the headwaters of China's three major rivers: the Yangtze River, the longest in China; the Yellow River, the second-longest; and the Lancang River, which is known as the Mekong River after it flows out of China.
As important parts of the Qinghai-Xizang Plateau ecosystem, the headwater regions of the Yangtze and Lancang rivers play a crucial role in safeguarding water resources, protecting biodiversity and ensuring ecological stability.
Annual scientific expeditions to the source of the Yangtze River have been conducted since 2012.

Qiao Qianglong, a member of a scientific expedition team of the Changjiang River Scientific Research Institute, conducts on-site fish monitoring at Zhimenda hydrologic station in Yushu Tibetan Autonomous Prefecture of northwest China's Qinghai Province, July 20, 2024. Chinese scientists launched an expedition on Saturday in the headwater regions of the Yangtze and Lancang rivers in northwest China's Qinghai Province, to investigate the regions' water resources and ecological environment. The expedition will conduct scientific investigations into the water resources, river hydrology, water ecology, glaciers, soil erosion and permafrost of the regions. (Xinhua/Wu Zhizun)

Liao Maoxin, a member of a scientific expedition team of the Changjiang River Scientific Research Institute, conducts soil multi-parameter detection at Zhimenda hydrologic station in Yushu Tibetan Autonomous Prefecture of northwest China's Qinghai Province, July 20, 2024. Chinese scientists launched an expedition on Saturday in the headwater regions of the Yangtze and Lancang rivers in northwest China's Qinghai Province, to investigate the regions' water resources and ecological environment. The expedition will conduct scientific investigations into the water resources, river hydrology, water ecology, glaciers, soil erosion and permafrost of the regions. (Xinhua/Wu Zhizun)

Qiao Qianglong (L), a member of a scientific expedition team of the Changjiang River Scientific Research Institute, conducts on-site fish monitoring at Zhimenda hydrologic station in Yushu Tibetan Autonomous Prefecture of northwest China's Qinghai Province, July 20, 2024. Chinese scientists launched an expedition on Saturday in the headwater regions of the Yangtze and Lancang rivers in northwest China's Qinghai Province, to investigate the regions' water resources and ecological environment. The expedition will conduct scientific investigations into the water resources, river hydrology, water ecology, glaciers, soil erosion and permafrost of the regions. (Xinhua/Wu Zhizun)

Qiao Qianglong, a member of a scientific expedition team of the Changjiang River Scientific Research Institute, conducts on-site fish monitoring at Zhimenda hydrologic station in Yushu Tibetan Autonomous Prefecture of northwest China's Qinghai Province, July 20, 2024. Chinese scientists launched an expedition on Saturday in the headwater regions of the Yangtze and Lancang rivers in northwest China's Qinghai Province, to investigate the regions' water resources and ecological environment. The expedition will conduct scientific investigations into the water resources, river hydrology, water ecology, glaciers, soil erosion and permafrost of the regions. (Photo by Du Xiaowei/Xinhua)

An aerial drone photo taken on July 20, 2024 shows the Tongtian River, the major source of the Yangtze River, in Yushu Tibetan Autonomous Prefecture, northwest China's Qinghai Province. Chinese scientists launched an expedition on Saturday in the headwater regions of the Yangtze and Lancang rivers in northwest China's Qinghai Province, to investigate the regions' water resources and ecological environment. The expedition will conduct scientific investigations into the water resources, river hydrology, water ecology, glaciers, soil erosion and permafrost of the regions. (Photo by Du Xiaowei/Xinhua)

Liao Maoxin (L), a member of a scientific expedition team of the Changjiang River Scientific Research Institute, conducts soil multi-parameter detection at Zhimenda hydrologic station in Yushu Tibetan Autonomous Prefecture of northwest China's Qinghai Province, July 20, 2024. Chinese scientists launched an expedition on Saturday in the headwater regions of the Yangtze and Lancang rivers in northwest China's Qinghai Province, to investigate the regions' water resources and ecological environment. The expedition will conduct scientific investigations into the water resources, river hydrology, water ecology, glaciers, soil erosion and permafrost of the regions. (Xinhua/Wu Zhizun)

Han Cheng, a member of a scientific expedition team of the Changjiang River Scientific Research Institute, collects water sample at Zhimenda hydrologic station in Yushu Tibetan Autonomous Prefecture of northwest China's Qinghai Province, July 20, 2024. Chinese scientists launched an expedition on Saturday in the headwater regions of the Yangtze and Lancang rivers in northwest China's Qinghai Province, to investigate the regions' water resources and ecological environment. The expedition will conduct scientific investigations into the water resources, river hydrology, water ecology, glaciers, soil erosion and permafrost of the regions. (Xinhua/Wu Zhizun)
(Web editor: Zhang Kaiwei, Zhong Wenxing)"
"Palm-sized drone uses solar power, smashes records",2024-07-22,http://en.people.cn/n3/2024/0722/c90000-20196104.html,"Home>>
		
Palm-sized drone uses solar power, smashes records
 (China Daily) 08:31, July 22, 2024

The palm-sized solar-powered CoulombFly drone. XINHUA
A palm-sized Chinese drone weighing less than a sheet of paper has captured widespread media attention because its innovative motor allows it to continue flying as long as it receives sunlight.
The solar-powered machine was designed by researchers at Beihang University in Beijing, known for its expertise in aeronautical and astronautical research. It is just a 10th the size of the previous record-holder as the smallest solar-powered aircraft and one 600th of its weight.
Micro aerial vehicles have a host of applications, from environmental monitoring to search and rescue, making them versatile tools. They can perform specialized tasks such as capturing images, detecting objects, and transporting items in confined spaces. However, limited flight duration poses a significant obstacle to their usefulness.
Traditional micro aerial vehicles use electromagnetic motors to power their rotors. However, the small motors overheat at high speeds, causing a sharp drop in energy conversion efficiency. Natural sunlight can be a potential alternative as an energy source, but the smaller a drone gets, the less surface area it has to collect sunlight, lead researcher Qi Mingjing said.
In its study, published on Thursday in the journal Nature, the research team said that traditional flying machines weighing less than 10 grams could only stay aloft for up to 10 minutes.
To overcome the efficiency challenges, Qi and his colleagues developed an electrostatic motor that uses the Coulomb force, the force between electrically charged particles at rest, to generate continuous rotating motion. The drone's name, CoulombFly, comes from its unique motor.
A demonstration video presented by the researchers shows that the motor works by creating a circle of electric charges, which generates a twisting force to make a single blade spin like those on a helicopter.
The advantage of such a motor is that it can effectively reduce heat, co-author Peng Jinzhe said.
""This is because static electricity operates at high voltage and low current,"" Peng said. ""The lower the current, the less heat it generates.""
The energy conversion efficiency of flying machines weighing less than 5 grams and powered by such static electricity could exceed 10 times that of traditional electromagnetic motors, with less than a 10th of the power consumption required for the same lift, according to the study.
Before the breakthrough, Harvard University researchers published a paper in Nature in 2019 introducing the Robobee aircraft they developed, which was once considered the highest level in the field of micro aerial vehicles. However, it relied on an artificial light source, equivalent to three times the intensity of natural sunlight, for sustained flight.
The CoulombFly can achieve continuous flight solely relying on natural light, representing a significant leap forward, the Beihang researchers said.
After further development, the new drone motor technology is expected to be applied in emergency rescue operations, narrow space detection, and other similar scenarios, said Professor Yan Xiaojun, one of the lead researchers of the study.
(Web editor: Tian Yi, Zhong Wenxing)"
Mass global IT outage a wake-up call for resilient cyber security,2024-07-22,http://en.people.cn/n3/2024/0722/c90000-20196091.html,"Home>>
		
Mass global IT outage a wake-up call for resilient cyber security
 (Xinhua) 08:18, July 22, 2024
* Just hours following the outage, scams, phishing emails, and other criminal activities started to target CrowdStrike customers concerning the incident, under the guise of customer service and technical support.
* The fact that the largest global IT outage so far was caused not by cyberattacks or ill-intentioned actors but, ironically, by a routine update from a cybersecurity software, has once again exposed the systemic risk stemming from an increasingly omniscient and intertwined digital infrastructure and a world which relies on it.
* While individual organizations are recommended to spend more resources on off-grid back-ups and staff training over working without computers, some argue the incident showcases the urgency to regulate the highly monopolized market.

Long queues of passengers are seen in front of check-in counters in Singapore's Changi Airport on July 19, 2024. (Photo by Then Chih Wey/Xinhua)
BEIJING, July 21 (Xinhua) -- Airlines, media, retailers, hospitals, banks, and essentially, any organization that relied on CrowdStrike's service to protect their Microsoft system from viruses and malware, are still recovering from the unprecedented global IT outage on Friday, with 8.5 million Windows devices affected.
Experts and analysts regard the incident as a wake-up call for a more resilient and less monopolized global digital infrastructure, warning that the world will be more vulnerable facing such disruptions, which could become a ""new normal.""
UNPRECEDENTED OUTAGE
On Friday, customers across the world of CrowdStrike, a cybersecurity firm based in Austin, Texas, started to see the ""blue screen of death"" on their Windows system after installing a faulty Falcon sensor update on Thursday night.
Essentially, Falcon monitors what is happening on the computers on which it is installed and looks for signs of nefarious activity (such as malware). This means that Falcon is deeply integrated into Microsoft's system to the extent that when it falters, the system does too.
""We currently estimate that CrowdStrike's update affected 8.5 million Windows devices, or less than one percent of all Windows machines,"" said Microsoft in its blog post on Saturday.
Following what Microsoft calls ""significant incidents,"" the company said it has ""maintained ongoing communication with customers, and is working with CrowdStrike and external developers to collect information and expedite solutions.""

A banking ATM is out of service in Istanbul, Türkiye, July 19, 2024. (Xinhua/Liu Lei)
Just hours following the outage, scams, phishing emails, and other criminal activities started to target CrowdStrike customers concerning the incident, under the guise of customer service and technical support.
""The scale of this outage is unprecedented, and will no doubt go down in history,"" said Dr. Junade Ali, a cybersecurity expert and fellow at the London-based Institution of Engineering and Technology.
""Unlike some previous outages that targeted Internet infrastructure, this situation directly impacts end-user computers and could require manual intervention to resolve, posing a significant challenge for IT teams globally,"" Ali added.
Experts estimate a full recovery from a disruption at such a scale will take weeks. ""It seems that millions of computers are going to have to be fixed by hand,"" said Mikko Hypponen, chief research officer at WithSecure, a cybersecurity company.
Recovery is particularly challenging for small and medium-sized enterprises, which have fewer resources and IT staff to do the manual fixing, said Joe Tidy, a BBC cyber correspondent on Friday.
MORE DISRUPTIONS TO COME
Almost 30,000 flights were delayed on Friday and nearly 7,000 were canceled worldwide, according to Euronews.
The incident resulted in a significant drop in CrowdStrike's value, wiping billions off the company's market value when trading opened on Friday. The same day, Wall Street's major indexes declined, exacerbating a sell-off fueled by tech stocks and mixed earnings reports.
""The outage is likely to intensify regulations for critical services and risk management,"" said Dr. Madeleine Stevens, an IT expert at Liverpool John Moores University.
""Despite the incident not being a cyberattack, consumer skepticism will inadvertently be impacted, and this unintended demonstration of our cyber vulnerability will raise significant challenges for IT service providers,"" Stevens said.

Passengers wait at Milwaukee Mitchell International Airport in Milwaukee, Wisconsin, the United States, on July 19, 2024. (Xinhua/Wu Xiaoling)
The fact that the largest global IT outage so far was caused not by cyberattacks or ill-intentioned actors but, ironically, by a routine update from a cybersecurity software, has once again exposed the systemic risk stemming from an increasingly omniscient and intertwined digital infrastructure and a world which relies on it.
More ""digital pandemics"" like this are expected to emerge from enhanced global economic integration, said John Bryson, chair of Enterprise and Economic Geography at Birmingham Business School, the University of Birmingham.
The global cyber-energy-production plexus, or the ""multiple connections between telecommunications, energy, and production networks,"" leave us all exposed to unknown disruptions at an unprecedented scale, Bryson added.
Axel Legay, a professor of computer science at the Catholic University of Leuven, said that the more interconnected a computer is, the more vulnerable it becomes.
""The more interconnected the software is, the more vulnerable we will be, because more and more software will interact and it will increase,"" Legay said in an interview with Euronews Next.
BACK-UPS AND ANTI-TRUST
The largest cyber incident so far has offered lessons to stakeholders from tech companies, regulators, and businesses to prepare for more frequent and widespread disruptions in digital infrastructure in the future.
""A core issue is the ability of a digitally-enabled service function to switch immediately to manual,"" Bryson said.
""In other words, there needs to be an ability to provide services using paper rather than digital solutions. The real danger is that we all forget how to live and work in a pre-digital environment,"" he said.
The IT expert also highlighted the importance of companies having ""air-gapped"" back-ups, which are isolated from the cyber-energy-production plexus.
While individual organizations are recommended to spend more resources on off-grid back-ups and staff training over working without computers, some argue the incident showcases the urgency to regulate the highly monopolized market.

Passengers are seen at Vancouver International Airport in Richmond, British Columbia, Canada, on July 19, 2024. (Photo by Liang Sen/Xinhua)
The outage ""is the result of a software monopoly that has become a single point of failure for too much of the global economy,"" George Rakis, executive director of NextGen Competition, whose group advocates for more stringent antitrust enforcement, was quoted as saying by The Washington Post on Saturday.
The report added that legislators from three Congressional committees -- House Oversight, House Homeland Security, and House Energy and Commerce -- asked Microsoft and CrowdStrike to brief them on the cause and impact of the outage on various agencies on Friday.
""When just three companies -- Microsoft, Amazon, and Alphabet Inc.'s Google -- dominate the market for cloud computing, one minor incident can have global ramifications,"" wrote Parmy Olson, a Bloomberg Opinion columnist covering technology, on Friday.
Olson argues that policymakers could address the world's over-reliance on just three cloud providers and push the Big Techs to do more than simply administer a band-aid.
Why does a global computational infrastructure seem to have one point of failure? Brooklyn-based columnist Edward Ongweso Jr. asked in a Guardian analysis on Saturday.
Because of concentration, consolidation, and monopolization, he argued. ""We've had these sorts of outages before and nothing has changed, partly because the tech industry has been so adept at shifting blame. If that continues, then the monopolists will do what they please and everyone will suffer what they must,"" he said.
(Web editor: Zhang Kaiwei, Zhong Wenxing)"
"Beijing to build pharmaceutical innovation park, eyeing global scientists",2024-07-19,http://en.people.cn/n3/2024/0719/c90000-20195821.html,"Home>>
		
Beijing to build pharmaceutical innovation park, eyeing global scientists
 (Xinhua) 16:39, July 19, 2024
BEIJING, July 19 (Xinhua) -- Beijing has unveiled a plan to construct an international pharmaceutical innovation park in a southern suburb and attract global scientists in medicine and health.
The park will be located in the Beijing Economic-Technological Development Area, also dubbed Beijing E-Town, it was announced at the Third Conference of Global Health Forum of Boao Forum for Asia, which concluded Thursday.
With a planned area of 5.8 square km, the park will feature a cluster of international corporate headquarters, and focus on the fostering of world-class specialized hospitals and medicine-related industries.
The park will target frontier fields of health such as quantitative synthetic biology, new-generation high-throughput sequencing technology, and therapeutic gene editing technology, said Kong Lei, director of the management committee of the Beijing E-Town.
""It will attract strategic scientists, world-class leaders and innovation teams in science and technology from around the world,"" Kong said.
Beijing E-Town recently released the first group of artificial intelligence (AI) application scenarios, involving 10 fields such as medicines, health and pharmaceutical R&D.
""We will promote the integration of biotechnology and information technology, and boost new medicine R&D through AI computing power,"" Kong added.
(Web editor: Zhang Kaiwei, Zhong Wenxing)"
