Title,Date,URL,Article
Continuous innovation injects growth momentum to Chinese enterprises,2024-07-19,http://en.people.cn/n3/2024/0719/c90000-20195746.html,"Home>>
		
Continuous innovation injects growth momentum to Chinese enterprises
By Li Hongxing (People's Daily) 15:28, July 19, 2024
In a busy, dimly lit production workshop on the second floor of a building of a Chinese pharmaceutical company in Guangzhou, south China's Guangdong province, no workers were found, except a staff member overseeing the high-speed production line for packaging of traditional Chinese medicine (TCM).
""If we didn't have visitors, we wouldn't even need these few lights on. The robots work 'silently' here,"" said an executive of the company, namely Guangzhou Baiyunshan Zhongyi Pharmaceutical Company Limited, a subsidiary of China's leading TCM manufacturer Guangzhou Pharmaceutical Holdings Limited (GPHL).
The workshop is a digital workshop, according to the executive, who noted that operations such as pill packaging, sealing, inspection, and boxing are basically handled by intelligent control technologies and advanced sensor detectors.

Photo shows an intelligent production line of Guangzhou Baiyunshan Zhongyi Pharmaceutical Company Limited, a subsidiary of China's leading TCM manufacturer Guangzhou Pharmaceutical Holdings Limited (GPHL). (Photo from Guangzhou Baiyunshan Zhongyi Pharmaceutical Company Limited)
The digital workshop does more than just save energy. Compared to traditional pharmaceutical manufacturing methods, the digital production line has increased productivity by 148 percent, reduced labor costs by 74 percent, and improved per capita efficiency by 289 percent.
By empowering development with digital and intelligent technologies and building smart factories for TCM production, the time-honored TCM brand is sprouting new buds in its transformation and upgrading.
As the world's first TCM company to enter the Fortune Global 500 list, GPHL has turned to digitalization and intelligentization for breakthroughs in injecting new vitality into TCM, a treasure of ancient Chinese science, as well as the production of TCM decoction pieces and Chinese patent medicine, a part of traditional manufacturing.
The group has explored digital traceability for medicinal herbs, pioneered smart TCM pharmacies, and built benchmark digital factories.
Through a series of reform measures for innovation, the group has empowered over 30 types of its products with digital and intelligent technologies, promoting the transformation and upgrading of the TCM industry while giving a powerful boost to the modernization and internationalization of TCM.
The experience of GPHL has shown that by seizing the initiative in transformation and upgrading, companies, regardless of their industry, can enhance their competitiveness and gain a market edge.
In fact, more companies in the country have experienced the effectiveness of intelligent and digital transformation in addressing various common problems.
In particular, many companies have carried out transformation based on their products and specific situations, finally standing out in competition by leveraging digital technologies in a targeted manner to address their weaknesses.

An intelligent production line of a tech company based in southwest China's Chongqing municipality runs at full capacity to manufacture auto parts in a digital workshop. (People's Daily Online/Li Hui)
For example, a dairy company in Guiyang, southwest China's Guizhou province, has integrated data chains across milk sources, factories, and marketing to determine production based on sales and breeding based on production, achieving cost reduction and efficiency improvement.
A manufacturing company in Mianyang, southwest China's Sichuan province, has reduced its product defect rate by 5 percent and annual production costs by over 10 million yuan through technological means including intelligent sensing and visual inspection.
By focusing on development needs, addressing key challenges, and adopting targeted means, companies have avoided detours and carried out effective transformation and upgrading, gaining fresh momentum for high-quality development.
Believing that an innovation and quality-oriented path is the inevitable choice for driving high-quality development, companies are marching forward toward bigger ambitions.
""Only by constantly striving for progress can we move forward,"" said the above-mentioned executive of Guangzhou Baiyunshan Zhongyi Pharmaceutical Company Limited.
Many Chinese enterprises are promoting technological innovation and industrial progress based on their actual situations, continuously unleashing innovative and creative vitality to help cultivate new quality productive forces.
The concept of ""progress coming from the desire to advance"" has also served as a method for the development of various companies, fields, and industries across the country.
Maintaining a consistent pursuit of high-quality development, China has been tirelessly expanding and extending the breadth and depth of development, overcoming difficulties, and innovating boldly to write new chapters and reach new heights in its growth.
(Web editor: Chang Sha, Liang Jun)"
Researchers identify new therapeutic target for ovarian cancer,2024-07-19,http://en.people.cn/n3/2024/0719/c90000-20195735.html,"Home>>
		
Researchers identify new therapeutic target for ovarian cancer
 (Xinhua) 15:19, July 19, 2024
WUHAN, July 19 (Xinhua) -- Researchers have recently identified eTreg cells as a new immunotherapy target for high-grade serous ovarian cancer (HGSOC), paving the way for new precision treatment strategies.
Ovarian cancer has long ranked among the top ten malignant tumors in women, with HGSOC accounting for nearly 70 percent of cases. For clinically challenging cases where complete surgical removal is difficult, the standard treatment strategy remains platinum-based neoadjuvant chemotherapy.
This approach initially achieves high response rates but often leads to drug resistance over time. As a result, the five-year survival rate for patients has stagnated around 30 percent, highlighting the persistent challenges in improving outcomes for HGSOC.
Homologous recombination deficiency (HRD) refers to a condition where cells have impaired ability to repair DNA double-strand breaks through the homologous recombination pathway.
HRD is often associated with an increased risk of genomic instability and cancer development. The presence of HRD in HGSOC not only contributes to its development but also impacts treatment strategies.
Researchers from Tongji Hospital in China and the MD Anderson Cancer Center in the United States initiated a clinical trial of the neoadjuvant PARP inhibitor niraparib for HRD-positive HGSOC based on the concept of reverse translational medicine.
PARP represents a family of enzymes involved in DNA repair. PARP inhibitors block these enzymes, preventing cancer cells, especially those with HRD, from repairing DNA damage, leading to cell death.
During the four-year study, researchers analyzed the unique immune characteristics of the microenvironment in HGSOC, and utilized single-cell transcriptome sequencing and T-cell receptor sequencing to screen tens of thousands of potential targets, according to Gao Qinglei, a professor from the Tongji Hospital.
They identified a novel immune target, eTreg cells, in HRD-positive ovarian cancer, and proposed an immunotherapy strategy that involves depleting eTreg cells and activating immune cells to effectively target and treat the tumors.
They also established HRD mouse models, and discovered that depleting eTregs in the models, with or without PARP inhibition, significantly suppresses tumor growth without observable toxicities, underscoring the potential of eTreg-focused therapeutics for HGSOC and other HRD-related tumors.
""The challenge in treating ovarian cancer lies in cancer cells evading the body's immune defenses. Not only do they escape the surveillance of the immune system, but they also 'capture' immune cells,"" Gao said.
She noted that by eliminating eTreg cells, the ""imprisoned"" immune cells can be activated to regain their ability to recognize and kill cancer cells.
The study was published in the international journal Cell.
(Web editor: Zhang Kaiwei, Zhong Wenxing)"
Chinese researchers develop ultralight sunlight-powered micro aerial vehicle for sustained flight,2024-07-19,http://en.people.cn/n3/2024/0719/c90000-20195703.html,"Home>>
		
Chinese researchers develop ultralight sunlight-powered micro aerial vehicle for sustained flight
 (Global Times) 14:48, July 19, 2024

CoulombFly. (Photo: WeChat account of Beihang University)
Chinese researchers have successfully developed an ultralight sunlight-powered micro aerial vehicle (MAV) weighing only 4.21 grams, capable of sustained flight using natural sunlight as its power source, which is expected to have wide applications in the national economy, according to Beihang University. The study was published in the journal Nature on July 17.
The MAV has a wingspan of 20 centimeters and weighs 4.21 grams. It's powered by a new type of electrostatic motor as its engine core, which enables takeoff and sustained flight solely on natural light energy.
The research achievement was independently developed by a research team at Beihang University, and is expected to significantly increase the flight duration of MAVs, expanding its range of applications in the future, the university said in a report published on its official WeChat account on Thursday.
Limited flight duration is a considerable obstacle to the widespread application of MAVs, especially for ultralight MAVs weighing less than 10 grams, which, in general, have a flight endurance of no more than 10 minutes, researchers from Beihang University wrote in the study published in Nature, titled ""Sunlight-powered sustained flight of an ultralight micro aerial vehicle.""
Previous studies have not been able to achieve sustained untethered flight of ultralight MAVs fully powered by natural sunlight due to limited payload capacity and low lift-to-power efficiency of traditional propulsion systems. Sunlight power is a potential alternative to improve endurance of MAVs, according to the study.
Due to MAVs' small size, light weight, and high maneuverability, MAVs can perform specialized tasks such as photography, detection, and transportation in confined spaces with wide applications in the national economy.
MAVs often have short flight times, because traditional electromagnetic motors used in these vehicles generate heat and have low energy conversion efficiency when miniaturized. The efficiency can drop to below 10 percent, making it difficult to meet flight requirements even with solar energy as a power source due to limitations in solar panel area, according to the researchers.
In order to solve the problems, researchers developed a micro electrostatic motor, and successfully tested flying the electrostatic aerial vehicle ""CoulombFly."" The motor has low speed, low heat generation, and high efficiency in a small size, making it a breakthrough in micro engine principles, said the university.
(Web editor: Tian Yi, Zhong Wenxing)"
China launches new Earth observation satellite,2024-07-19,http://en.people.cn/n3/2024/0719/c90000-20195627.html,"Home>>
		
China launches new Earth observation satellite
 (Xinhua) 13:04, July 19, 2024

A Long March-4B carrier rocket carrying the Gaofen-11 05 satellite blasts off from the Taiyuan Satellite Launch Center in north China's Shanxi Province on July 19, 2024. (Photo by Feng Yang/Xinhua)
TAIYUAN, July 19 (Xinhua) -- China on Friday sent a new Earth observation satellite into space from the Taiyuan Satellite Launch Center in north China's Shanxi Province.
The Gaofen-11 05 satellite was launched at 11:03 a.m. (Beijing Time) by a Long March-4B carrier rocket and entered the planned orbit successfully.
It will be used in a variety of fields including land surveys, urban planning, road network design, crop yield estimation and disaster relief.
The launch marked the 528th flight mission of the Long March carrier rocket series.

A Long March-4B carrier rocket carrying the Gaofen-11 05 satellite blasts off from the Taiyuan Satellite Launch Center in north China's Shanxi Province on July 19, 2024. (Photo by Feng Yang/Xinhua)

A Long March-4B carrier rocket carrying the Gaofen-11 05 satellite blasts off from the Taiyuan Satellite Launch Center in north China's Shanxi Province on July 19, 2024. (Photo by Feng Yang/Xinhua)

A Long March-4B carrier rocket carrying the Gaofen-11 05 satellite blasts off from the Taiyuan Satellite Launch Center in north China's Shanxi Province on July 19, 2024. (Photo by Feng Yang/Xinhua)
(Web editor: Zhang Kaiwei, Zhong Wenxing)"
"24 hours in Hefei, China’s emerging innovation and tech hub",2024-07-19,http://en.people.cn/n3/2024/0719/c90000-20195589.html,"Home>>
		
24 hours in Hefei, China’s emerging innovation and tech hub
 (People's Daily Online) 10:19, July 19, 2024
Which city has been the fastest developing city in China in recent years? Many people give the answer: "" Hefei!”
Two years ago, Hefei's aggregate economic ranking was outside the top 80 cities in China, but today it is ranked in the top 20.
Hefei's economic turnaround is inseparable from scientific and technological innovation. In a 2023 report produced by publication Nature, a well-known scientific magazine, Hefei was placed at 13th in a ranking of the world's scientific research cities.
In innovation driven Hefei, what does a day look like？
Time: 8 a. m.
Battery expert Xu Aiqin: ""Powering up the leading industry""
It is the daily work of battery expert Xu Aiqin to find a balance between battery life, charging, weight and cost performance.

Battery expert Xu Aiqin is testing battery safety(People's Daily Online/Chen Hao)
The automotive industry is the premier industry of Hefei city, Anhui Province. In recent years, Anhui automotive industry pioneering company Jianghuai Automobile Co., Ltd. (JAC) has adeptly navigated the changing landscape, focusing on the new energy vehicle (NEV) sector. In 2011, upon graduating from Hefei University of Technology with a master’s degree in Vehicular Engineering, Xu committed herself to the growing field of NEVs. She has since been a part of the development of 10 new pure electric vehicles for JAC.
At 8 a.m., Xu arrives at the battery safety test cabinet. Today's task is to observe the safety performance of the new batteries at extreme conditions, including testing the batteries at temperatures up to 130℃.
“In the battery field, thermal runaway safety, - that is, ensuring the safety of the entire battery pack when a single cell fails – is of the utmost importance,” Xu explained. After investing a great deal of time and effort, JAC has introduced a revolutionary new battery design. The new design, which is in the shape of a honeycomb, achieves thermal isolation, electric isolation, and thermal decoupling creating a much safer battery. “Each battery undergoes 100 consecutive explosion tests, in which there is zero tolerance for any thermal spread following a single cell combustion,” added Xu, emphasizing the strict safety standards in place.
Small sized yet powerful battery packs are driving NEVs forward and are helping to promote the development of Hefei’s premier industry. In 2023, Hefei produced 1.34 million vehicles,
Time: 2 p.m.
Entrepreneur Han Dongcheng: ""The core technology that cannot be bought""
""Today, I’m not holding the usual script,” said University of Science and Technology of China President Bao Xinhe on June 22 at the school’s graduation ceremony. Being able to deliver the speech without notes was not because of a sudden boost in memory, but thanks to the assistance of Han Dongcheng, a PhD graduate majoring in optics at the university, Bao added.

The picture is Han Dongcheng, who is conducting the experiment. (Photo by Xu Ganjiang)
The ""help"" Bao refers to is the ""Interactive aerial imaging technology"" independently developed by Han.
This technology allows an image of Bao’s script to appear in the air in front of him, without it being visible to anyone else. What’s more, people can operate and work on the displayed images in the same manner one would use a computer screen.
After finishing with visitors in the morning, it was already 2 p.m. These days, many people visit Anhui Easpeed Co., Ltd., which was founded by Han in 2016. At that time, he was still a first-year master’s degree student at the University of Science and Technology of China.
""The key to the realization of air imaging is in the glass,” says Han. In Anhui Easpeed Co., Ltd., there is a room stacked with substandard glass. ""Each piece represents a failure and the beginning of a new attempt,” added Han.
With the successful development of the negative refractive slab lenses, or DCT-plates, and the sensors required for interaction, Anhui Easpeed Co., Ltd. has mastered the interactive aerial imaging technology.
""Core technology can't be bought,” exclaimed Han. Looking back on the journey, Han reflected emotionally regarding how the technology was once controlled by others. Today though, the company has repositioned itself from follower, to competitor, to leader in the industry. As a now industry leader, the company has been able to apply its technology in fields such as displays, medical equipment, automobiles, home appliances, and more. The company is currently valued at 3 billion yuan ($ 412 million).
In Hefei, technological entrepreneurship is thriving. The city has cultivated 188 national-level specialized and innovative ""little giant"" enterprises, over 8000 national high-tech enterprises and 11,000 national science and technology based small-medium sized enterprises.
Time: 8 p.m.
Key technical expert Sun Hantao: ""The industries of the future are already here""
At 8 p.m., Sun finished his day's work.
Recently, as the key technical expert of China Telecom Quantum Group, Sun is particularly busy. ""We are currently working with several enterprises, using the recently announced 504-bit ‘Xiaohong’ chip, to develop a full-scale quantum computer. The system will be integrated into the independently developed ‘Tianyan’ quantum computing cloud platform, which will be made available to users across the globe,” said Sun.

Sun Hantao discusses technical issues with his colleagues (People's Daily Online/Chen Ruotian)
Sun, born in the 90s, is from Henan Province, central China. Ten years ago, after graduating from Jilin University, he directly entered into a PhD program at Peking University, studying quantum transport. In 2019, he entered the industry and joined a major internet company in Hangzhou. At the beginning of this year, he relocated to Hefei and became the leader of the quantum computing technology department of China Telecom Quantum Group, where he is responsible for the group's cloud platform construction, physical machine control and other work.
The achievements of Sun and his colleagues are obvious to all.
Taking the cloud platform as an example, the ""Tianyan"" quantum computing cloud platform has currently integrated the same 176-bit superconducting quantum computer as the Zuchongzhi No. 2, achieving leadership in both real machine and simulation capabilities. Sun reveals that the group has also developed a quantum programming framework based on domestically produced instruction sets, as well as an ecosystem for quantum computing education and industrial applications, effectively securing control over both hardware and software.
""The number of quantum enterprises in Hefei ranks first in China, including a premier enterprise in the industry like China Telecom Quantum Group,"" said Sun. Sun will continue to work hard to contribute to the development of the industry.
With the efforts of people like Sun, Hefei quantum information, fusion energy, deep space exploration and other future industries will be developed.
Time: 2 a. m.
Researcher Liu Xiaodi: ""Devoted to the ‘Cold Bench’ of basic research“
At 2 a. m., Liu sat in front of the testing instrument and carefully observed the changes of hydrogen under different pressures. ""It takes at least 10 hours to charge the hydrogen into the press and to record the data,” said Liu. For her, doing experiments all night is common.

Liu Xiaodi is doing research, and for her, doing experiments all night is common(People's Daily Online/Chen Hao)
Liu is a researcher at the Institute of Solid State Physics, Hefei Institutes of Physical Science, Chinese Academy of Sciences. In 2013, after graduating from the University of Science and Technology of China, she sat on the ‘cold bench’, a term for unheralded tasks, for basic research and dedicated herself to the production of metallic hydrogen. ""Almost all of my work revolves around this main thread,” said Liu.
The production of metallic hydrogen is known as the 'Holy Grail of High Pressure Physics', which explains just how difficult the task is.
""Creating ultra-high pressure is one of the most difficult problems,"" according to Liu. There is speculation that to get metallic hydrogen, pressures of 5 or 6 million atmospheres are required. For context, 10,000 atmospheres are roughly the equivalent pressure created by an elephant stepping on something while wearing high heels.
In the experiment, she operates a press using diamond anvil cells (DAC) to apply pressure to the hydrogen. ""At present, our pressure is close to the pressure needed to produce metallic hydrogen,” said Liu.
""It gives us great confidence,"" Liu remarks, indicating that through the optimization of the press, diamond anvil cells, and the process involved, it will soon be possible to achieve ultra-high pressure. With ultra-high pressure achieved, it will be possible to successfully produce metallic hydrogen, allowing for the exploration of its novel properties including superconductivity and superfluidity.
When Liu Xiaodi walked out of the laboratory, there was already daylight.
This is an ordinary 24 hours in innovative Hefei.
A new day, and it all begins again.
(Pan Yidan, as an intern, also contributed to this article.)
(Web editor: Sheng Chuyi, Liang Jun)"
World's first report of a rare B subtype blood identified in North China's Hebei Province,2024-07-19,http://en.people.cn/n3/2024/0719/c90000-20195580.html,"Home>>
		
World's first report of a rare B subtype blood identified in North China's Hebei Province
 (Global Times) 09:50, July 19, 2024
Even rarer than Rh-negative blood, a B subtype blood has been identified in a hospital in Handan, North China's Hebei Province for the first time worldwide, expanding to scientific understanding of blood types and enhancing the effectiveness of blood transfusions.
Cui Ningning, a technician from the Handan First Hospital's blood transfusion department received a novel specimen from a patient who was recommended for blood transfusion in April, according to local media on Thursday.
Despite several attempts, Cui failed to identify the donor's blood type.
Cui then reported the unusual situation to the head physician Dong Peiyun, who, relying on extensive expertise, acutely recognized that the sample was likely to be subtype B.
Following a series of serologic identifications of the patient's specimens, the results confirmed Dong's initial judgement, according to the media.
As identified, the rare blood type belongs to a new subtype of type B.
The genetic sequence of this blood type has been submitted to the US National Center for Biotechnology Information (NCBI) t, and it has been formally added to the human DNA sequence database within the NCBI under the code PP928483, according to media reports.
Dong explained that accurate blood group matching is essential for safe blood transfusion since the blood group system is characterized by a multitude of novel subtypes that arise due to genetic changes in humans.
Finding this rare blood type will not only broaden scientific understanding of blood types, but also further guarantee the safety of clinical blood transfusions, Dong added.
(Web editor: Tian Yi, Zhong Wenxing)"
