Title,Date,URL,Article
China's Shenzhou-18 manned spaceship successfully launched,2024-04-30,http://en.people.cn/n3/2024/0430/c90000-20163723.html,"Home>>
		
China's Shenzhou-18 manned spaceship successfully launched
By Liu Shiyao, Gu Yekai (People's Daily) 14:22, April 30, 2024
At 8:59 p.m. (Beijing Time) on April 25, China's Shenzhou-18 manned spaceship, atop a Long March-2F carrier rocket, blasted off from the Jiuquan Satellite Launch Center in northwest China. About 10 minutes after the launch, the Shenzhou-18 spaceship separated from the rocket and entered its designated orbit, marking the success of China's first manned mission in 2024.
The Shenzhou-18 crew members are Ye Guangfu, Li Cong and Li Guangsu, with Ye as the mission commander. The Shenzhou-18 mission is the third manned mission during the application and development stage of China's space station and the 32nd flight mission of China's manned space program.

The Shenzhou-18 manned spaceship, atop a Long March-2F carrier rocket, blasts off from the Jiuquan Satellite Launch Center in northwest China, April 25, 2024. (People's Daily Online/Chen Kun)
The Shenzhou-18 crew will rotate with the Shenzhou-17 crew in orbit and stay in the space station for about six months, during which they will carry out space science and application experiments, extravehicular activities (EVAs), and cargo transportation, space debris shelters installation, extravehicular payloads and equipment installation and recovery, and popular science education and public welfare activities, to further improve the operational efficiency of the space station.
During the crew's stay in orbit, they will witness the arrival of the Tianzhou-8 cargo craft and Shenzhou-19 crewed spaceship. The Shenzhou-18 crew are scheduled to return to the Dongfeng landing site in north China's Inner Mongolia autonomous region in late October this year.
China Manned Space Agency (CMSA) spokesperson Lin Xiqiang said the Shenzhou-18 crew will manage and care for the space station and its payloads during their stay in orbit, and conduct maintenance, repairs, and status inspections to ensure the safe, reliable, and efficient operation of the space station.
The crew will utilize the scientific experiment cabinets and extravehicular payloads to carry out more than 90 experiments in the fields of basic physics in microgravity, space material science, space life science, space medicine and space technology.
For instance, they will implement China's first in-orbit aquatic ecological research project. Using zebrafish and coontail to establish a self-cycling aquatic ecosystem in orbit, the project aims to make to a breakthrough in the cultivation of vertebrates in space.
The crew will also make the world's first in-orbit stem cell study on the plant's stem tips to explore plant evolutionary adaptation to gravity and provide theoretical support for space cropping.
So far, China has carried out more than 130 scientific research and application projects in its orbiting space station, and more than 300 scientific experiment samples have been brought back from space by manned missions in five batches.
The Shenzhou-18 astronauts will carry out two to three EVAs and implement six cargo outbound deliveries via the station's cargo airlock module. During the EVAs, based on the existing space debris protection mechanism at the station, the astronauts will install debris protection reinforcements for extravehicular piping, cables, and critical equipment. They will also carry out extravehicular inspections, as appropriate, to further ensure the safety of the space station.
According to Lin, some of the solar panel cables on the space station were damaged by space debris impacts, leading to a partial loss of power supply capacity. The problem was solved by the Shenzhou-17 crew during two spacewalks, which marked China's first extravehicular maintenance and proved that manned spacecraft can better deal with unexpected issues in orbit.
In 2023, China initiated the lunar landing mission of its manned lunar exploration program, aiming to realize a manned lunar landing by 2030. All component systems are under research and development as planned.
The project development of major flight products, such as the Long March-10 carrier rocket, the manned spacecraft Mengzhou, the lunar lander Lanyue and the lunar landing suit, has been completed, and their prototype production and tests are being carried out.
The development of mechanical and thermal test products for manned spacecraft and landers has been basically completed; rocket engines of various types are under ground tests; and the Wenchang manned lunar exploration launch site is under construction. The proposals for manned lunar rovers and lunar surface payloads solicited from the public are under selection.
(Web editor: Chang Sha, Liang Jun)"
China’s commercial aerospace companies speed up launch schedule following clear goal,2024-04-30,http://en.people.cn/n3/2024/0430/c90000-20163591.html,"Home>>
		
China’s commercial aerospace companies speed up launch schedule following clear goal
By Tao Mingyang and Wang Yi (Global Times) 10:20, April 30, 2024

The exhibition site of ""Business Aerospace"" at the 2024 Zhongguancun Forum on April 29, 2024 Photo: Tao Mingyang/GT
With China's increasing focus on the commercial aerospace industry, multiple Chinese private companies unveiled their launch arrangements for the year at the 2024 Zhongguancun Forum (ZGC Forum), demonstrating a clear map for the development of private commercial aerospace industry.
Zhang Changwu, CEO of Chinese commercial aerospace company LandSpace, told the Global Times on Monday that the company plans to conduct four launches this year and nine launches next year.
""This year and next year will see a mass delivery of ZQ-2 rocket. The current goal is to achieve the first flight of ZQ-3 as scheduled next year, and to be able to successfully land the first stage of our reusable rockets within the first three launches,"" Zhang said.
LandSpace's ZQ-2, the world's first liquid oxygen and liquid methane carrier rocket, was successfully launched last July, carrying a satellite into orbit.
Kang Yonglai, founder and president of another Chinese private rocket company Space Pioneer, said that the company's ""Falcon 9 equivalent"" large liquid-propellent reusable rocket model TL-3 will commence its first trial flight in July 2024.
We will have two launches next year, and the first will carry 18 satellites into orbit, followed by the second launch carrying 36 satellites, Kang said.
China is also enhancing the construction of satellite launching infrastructure to meet the increasing demand for commercial launch missions nationwide. Local media reported that the country's first commercial spacecraft launch site in Wenchang, South China's Hainan Province, is expected to become operational within the year.
Kang noted that Space Pioneer's three flights this year will be all conducted at the site in Hainan.
In 2023, China's commercial aerospace companies completed 26 rocket launch missions, accounting for 39 percent of the overall volume of space launches, and the size of China's commercial aerospace market is estimated to surpass 2.3 trillion yuan ($317 billion) in 2024, per China Media Group.
Wang Yeucheng, chief analyst of Taibo Research, who focuses on the commercial aerospace industry, told the Global Times on Monday that the satellite internet industry is a core component of the commercial aerospace industry, accounting for approximately one-third of the entire space economy and is growing rapidly.
The size of the satellite internet industry reached $231 billion in 2023 and is expected to reach $319 billion in 2030. The size of the space economy reached $630 billion in 2023 and is projected to reach $1.16 trillion in 2030, according to Global and China Satellite Internet Industry Research, a report released by Taibo Research, at the Aerospace Information Industry Innovation and Development Forum on Monday.
""For the sustainable development of the entire industry, the most important factor is ensuring that future large-scale projects have good performance and can be achieved at a low cost. In other words, they deliver market value and are economically viable, so that they can serve the public in the long term and meet daily communication needs,"" Zhang said.
Wang said that China's satellite constellation and satellite internet service will ensure the nation's data security, and has broad export prospects for Belt and Road Initiative partnership countries.
The Chinese government has placed great emphasis on the satellite internet industry, concentratedly issuing a series of policies related to the satellite internet industry especially since around 2021.
Beijing's Haidian district, where the ZGC Forum is being held, published an action plan on Sunday to develop commercial aerospace innovation. The plan aims to achieve a commercial space industry with a scale exceeding 100 billion yuan, with more than 1,000 satellites in orbit within four years.
(Web editor: Tian Yi, Liang Jun)"
"China's Shenzhou-17 separates from space station combination, starts journey home",2024-04-30,http://en.people.cn/n3/2024/0430/c90000-20163534.html,"Home>>
		
China's Shenzhou-17 separates from space station combination
 (Xinhua) 09:21, April 30, 2024
JIUQUAN, April 30 (Xinhua) -- China's Shenzhou-17 manned spaceship separated from the space station combination on Tuesday, and the astronauts aboard -- Tang Hongbo, Tang Shengjie and Jiang Xinlin -- are returning to Earth, according to the China Manned Space Agency.
(Web editor: Zhang Kaiwei, Liang Jun)"
Media forum in Beijing discusses AI development,2024-04-30,http://en.people.cn/n3/2024/0430/c90000-20163462.html,"Home>>
		
Media forum in Beijing discusses AI development
 (Xinhua) 08:41, April 30, 2024
BEIJING, April 29 (Xinhua) -- Focusing on the development of artificial intelligence (AI), the third CMG Forum was held on Monday in Beijing.
Li Shulei, a member of the Political Bureau of the Communist Party of China (CPC) Central Committee and head of the Publicity Department of the CPC Central Committee, attended the opening of the event and delivered a speech.
Guests at the forum stressed the role of media in promoting the innovative application of AI as well as its governance.
Efforts should also be made to boost the development of AI in creating positive, healthy, diverse and high-quality content, so that AI can become a force for good and benefit mankind, they agreed.
They also called on media to accelerate intelligent transformation, and help bridge international exchanges and cooperation on the governance of AI to facilitate its healthy, orderly and safe development.
Hosted by China Media Group (CMG), the forum attracted more than 200 participants from international organizations, media, think tanks, and multinational companies.
(Web editor: Zhang Kaiwei, Liang Jun)"
Beijing speeds up to build international tech innovation hub,2024-04-30,http://en.people.cn/n3/2024/0430/c90000-20163408.html,"Home>>
		
Beijing speeds up to build international tech innovation hub
By Zhao Chenjie, Wang Yihan and Li Chunyu (Xinhua) 08:13, April 30, 2024
BEIJING, April 29 (Xinhua) -- The 2024 Zhongguancun Forum (ZGC Forum) annual conference in Beijing has garnered global attention, and showcased China's strides in science and technology, underlining its continued commitment to openness and cooperation.
Themed ""Innovating for a Better World,"" the forum drew scientists, entrepreneurs and investors from over 100 countries and regions, and held some 120 events such as conferences, technology transactions and competitions in the past five days.

This photo taken on April 25, 2024 shows a scene at the release of scientific and technological achievements during the opening ceremony of the 2024 Zhongguancun Forum (ZGC Forum) annual conference in Beijing, capital of China. (Xinhua/Ren Chao)
Known as ""China's Silicon Valley,"" Zhongguancun in northwestern Beijing has attracted over 300 multinationals to set up their regional headquarters and research centers. Beijing houses nearly 100 colleges and universities and over 1,000 scientific research institutions.
The ZGC Forum, founded in 2007 with its enduring focus on innovation and development, has evolved into a national-level open innovation platform and an international forum over the years.
Being at the forefront of cultivating new quality productive forces in China, Beijing is expected to bring broad opportunities for the world in sci-tech innovation cooperation, investment in emerging high-tech industries and technology transfers, according to Jane Yang, managing partner of Ernst &Young Beijing Office.
INNOVATION HUB
""After we finished the roadshow during this year's forum, we received more than 20 cooperation intentions from investors, representatives of industrial parks and intellectual property partners,"" said Wang Yujing, a staffer of Beijing Boruikang Technology Co., Ltd.
During the forum's international advanced technology competition, the company showcased its self-developed brain closed-loop feedback system, which offers electrical stimulation nerve therapy with reduced trauma, securing the runner-up position.
The competition exemplifies Beijing's efforts in promoting technology transfer and encouraging entrepreneurship. Wang said that the ZGC Forum offers a platform to bolster its brand recognition in the medical equipment industry.

A woman walks past an art installation at the Zhongguancun International Innovation Center, venue for the 2024 Zhongguancun Forum (ZGC Forum) annual conference, in Beijing, capital of China, April 25, 2024. (Xinhua/Ren Chao)
Liu Debing, head of Zhipu AI, recounted the company's early days in 2019 when large language models (LLMs) were not yet widely known. Although the company had been unsuccessful in securing an investment, the administrative commission of Zhongguancun Science Park offered Liu's team a rent-free office space for three months to kickstart their initial development phase. Today, the company has evolved into a leading LLM unicorn in China.
According to a report released at the forum, Beijing is home to 114 unicorn companies, accounting for nearly one-third of the country's total, with an estimated value of 522.8 billion U.S. dollars.
In the field of cutting-edge science and technology, Beijing boasts about 43 percent of the country's top talents in artificial intelligence. The city is home to nearly half of the country's academicians from the Chinese Academy of Sciences and the Chinese Academy of Engineering, and the number of scientific researchers is over 550,000.
BETTER LIFE
At the ZGC Forum's exhibition area, a 1.65-meter-tall humanoid robot grabbed the attention. It is capable of stable navigation on gravel and snow terrains, climbing up and down stairs, and lifting heavy objects. According to Zhang Liang, a senior manager of Robot Era Technology Co., Ltd. based in Beijing, the robot's core components such as joint modules and dexterous hands can adapt to algorithms more efficiently for enhanced flexibility and precision in actions.
""Humanoid robots can be used for sorting, carrying and crafting work in the manufacturing sector and have the potential to contribute to health care and other fields,"" Zhang said. ""Tens of thousands of households can enjoy the convenience brought by humanoid robots in the future.""

This photo taken on April 26, 2024 shows an emergency rescue humanoid robot on display at the Zhongguancun Exhibition Center in Beijing, capital of China. (Xinhua/Li Xin)
This year's forum underscored the importance of facilitating scientific and technological innovation to drive social progress, improve people's wellbeing, and boost sustainable development.
""Science and technology is the solution for medicine, aging people, hunger and climate change,"" said Aaron Ciechanover, an Israeli biologist who won a Nobel Prize in Chemistry.
A 300-megawatt F-class heavy-duty gas turbine finishing final assembly was one of the major scientific and technological achievements unveiled at the forum. The machine is generally fueled by natural gas and its energy efficiency can reach 55 percent, higher than 35 percent to 46 percent of the traditional thermal power, according to Mo Jingfei, a staffer of China United Gas Turbine Technology Company.
""A single machine is expected to generate about 450,000 kWh electricity per hour, equivalent to one-eighth of the average hourly electricity consumption of residents in Beijing,"" said Mo, adding that it can also contribute to matching users' power needs through a peak-shaving mechanism.
""Playing a leading role in the global green shift, China not only promotes innovation but also pays attention to addressing relevant social impacts,"" said Irene Pivetti, honorary president of the World Green Design Organization.
FOSTERING INTERNATIONAL COOPERATION
""I hope that ZGC Forum can continue to enhance the international technology connection and invite global experts,"" said Kai-Fu Lee, chairman and CEO of Sinovation Ventures, adding that the world should regard Zhongguancun as innovative as Silicon Valley.

Journalists interact with a bionic humanoid robot at the Zhongguancun International Innovation Center, venue for the 2024 Zhongguancun Forum (ZGC Forum), in Beijing, capital of China, April 24, 2024. (Xinhua/Chen Zhonghao)
The P4 China-UK Precision Medicine Innovation Center officially went into operation in Beijing on Saturday. The center aims to promote cooperation between China and Britain in the field of life sciences, especially in the collaborative innovation of precision medicine.
Rahul Agarwal, a counselor of the British Embassy in Beijing, said that in addressing challenges in global health, Britain and China have carried out long-term and in-depth exchanges and cooperation. The diplomat expressed hopes that the bilateral cooperation will build a healthier and fairer world for future generations.
Arnout Jacobs, president of Springer Nature Greater China, said it facilitates a platform that gathers global experts in Beijing and contributes to quality scientific research.
""I can see that China is really open to the world and wants to collaborate, and we need to work with people of different expertise to tackle global challenges,"" he added.
(Web editor: Zhang Kaiwei, Liang Jun)"
