Title,Date,URL,Article
Chinese researchers carry out Arctic expedition at Yellow River Station in Norway,2024-06-26,http://en.people.cn/n3/2024/0626/c90000-20186051.html,"Home>>
		
Chinese researchers carry out Arctic expedition at Yellow River Station in Norway
 (Xinhua) 16:48, June 26, 2024

Members of the Chinese Arctic expedition team Hu Zhengyi (R), Zhao Hongying (C) and Wu Xiaohan go out for sampling in Ny-Alesund, Svalbard, Norway, June 22, 2024. (Xinhua/Zhao Dingzhe)
Situated at 79 degrees north latitude in the northwestern region of Spitsbergen, the largest island in Norway's Arctic Svalbard archipelago, Ny-Alesund is the world's northernmost permanent settlement.
Once a thriving coal mining town, Ny-Alesund now buzzes with the activities of polar researchers. Since the Yellow River Station's inception in 2004, China has established a significant presence in this scientific sanctuary, carrying out a range of observations and investigations in glaciology, terrestrial ecology, marine ecology, space physics, and other fields.
By the end of 2023, the Yellow River Station had supported more than 250 scientific research projects and hosted over 660 researchers. As China's first Arctic research station, it has witnessed not only the development of China's polar research efforts but also the endeavor and bravery of polar researchers in the face of perils and challenges.
""As a member of the Chinese Arctic expedition team, I am proud of our country's achievements in polar research,"" said Hu Zhengyi, head of the Yellow River Station.

Members of the Chinese Arctic expedition team Hu Zhengyi (L), Zhao Hongying (R) and Wu Xiaohan check the equipment in Ny-Alesund, Svalbard, Norway, June 22, 2024. (Xinhua/Zhao Dingzhe)

Wu Xiaohan, a member of the Chinese Arctic expedition team, takes a sample of sea water in Ny-Alesund, Svalbard, Norway, June 21, 2024. (Xinhua/Zhao Dingzhe)

Hu Zhengyi, a member of the Chinese Arctic expedition team, walks out for sampling in Ny-Alesund, Svalbard, Norway, June 22, 2024. (Xinhua/Zhao Dingzhe)

Members of the Chinese Arctic expedition team take a boat out for sampling in Ny-Alesund, Svalbard, Norway, June 22, 2024. (Xinhua/Zhao Dingzhe)

Members of the Chinese Arctic expedition team Zhao Hongying (L) and Wu Xiaohan take samples of sea water in Ny-Alesund, Svalbard, Norway, June 21, 2024. (Xinhua/Zhao Dingzhe)

This photo taken on June 21, 2024 shows a view outside the Yellow River Station in Ny-Alesund, Svalbard, Norway. (Xinhua/Zhao Dingzhe)

Members of the Chinese Arctic expedition team Hu Zhengyi, Zhao Hongying, Wu Xiaohan and Xu Hao (from L to R) pose for a group photo at the Yellow River Station in Ny-Alesund, Svalbard, Norway, June 23, 2024. (Xinhua/Zhao Dingzhe)

Hu Zhengyi, a member of the Chinese Arctic expedition team, works at the Yellow River Station in Ny-Alesund, Svalbard, Norway, June 21, 2024. (Xinhua/Zhao Dingzhe)

Hu Zhengyi, a member of the Chinese Arctic expedition team, points to one of the photos of Chinese Arctic expedition teams at the Yellow River Station in Ny-Alesund, Svalbard, Norway, June 23, 2024. (Xinhua/Zhao Dingzhe)

Zhao Hongying, a member of the Chinese Arctic expedition team, carries out a sampling operation at the Yellow River Station in Ny-Alesund, Svalbard, Norway, June 21, 2024. (Xinhua/Zhao Dingzhe)

Hu Zhengyi (R), a member of the Chinese Arctic expedition team, communicates with Special Advisor of Norwegian Polar Institute Kim Holmen at the Yellow River Station in Ny-Alesund, Svalbard, Norway, June 21, 2024. (Xinhua/Zhao Dingzhe)

Members of the Chinese Arctic expedition team Zhao Hongying (L) and Wu Xiaohan communicate at the Yellow River Station in Ny-Alesund, Svalbard, Norway, June 21, 2024. (Xinhua/Zhao Dingzhe)

This photo taken on June 21, 2024 shows the Yellow River Station in Ny-Alesund, Svalbard, Norway. (Xinhua/Zhao Dingzhe)
(Web editor: Zhang Kaiwei, Zhong Wenxing)"
Tallest building in Hainan surpasses halfway construction point,2024-06-26,http://en.people.cn/n3/2024/0626/c90000-20185931.html,"Home>>
		
Tallest building in Hainan surpasses halfway construction point
 (Ecns.cn) 14:32, June 26, 2024

The picture shows the Hainan Center project under construction in Haikou City, on June 25, 2024. (Drone photo: China News Service/Luo Yunfei)
The project consists of a 94-story main tower with a height of 428 meters and two auxiliary buildings. It integrates sightseeing, a super five-star hotel, office buildings, boutique businesses, and other functions, and will become the ""tallest building"" in Hainan after completion.
According to China Construction Third Engineering Bureau Co., construction of the tower has reached 50 floors, or 217.6 meters high, more than half of the progress. It is expected to be completed by the end of 2026.

The picture shows the Hainan Center project under construction in Haikou City, on June 25, 2024. (Drone photo: China News Service/Luo Yunfei)

The picture shows the Hainan Center project under construction in Haikou City, on June 25, 2024. (Drone photo: China News Service/Luo Yunfei)

The picture shows the Hainan Center project under construction in Haikou City, on June 25, 2024. (Drone photo: China News Service/Luo Yunfei)
(Web editor: Tian Yi, Zhong Wenxing)"
British students amazed by cutting-edge hospitality of hotels in S China’s Guangdong,2024-06-26,http://en.people.cn/n3/2024/0626/c98389-20185928.html,"Home>>
		
Tallest building in Hainan surpasses halfway construction point
 (Ecns.cn) 14:32, June 26, 2024

The picture shows the Hainan Center project under construction in Haikou City, on June 25, 2024. (Drone photo: China News Service/Luo Yunfei)
The project consists of a 94-story main tower with a height of 428 meters and two auxiliary buildings. It integrates sightseeing, a super five-star hotel, office buildings, boutique businesses, and other functions, and will become the ""tallest building"" in Hainan after completion.
According to China Construction Third Engineering Bureau Co., construction of the tower has reached 50 floors, or 217.6 meters high, more than half of the progress. It is expected to be completed by the end of 2026.

The picture shows the Hainan Center project under construction in Haikou City, on June 25, 2024. (Drone photo: China News Service/Luo Yunfei)

The picture shows the Hainan Center project under construction in Haikou City, on June 25, 2024. (Drone photo: China News Service/Luo Yunfei)

The picture shows the Hainan Center project under construction in Haikou City, on June 25, 2024. (Drone photo: China News Service/Luo Yunfei)
(Web editor: Tian Yi, Zhong Wenxing)"
Newly-developed neural probe achieves brain-wide neuronal activity recording in macaque brain in China,2024-06-26,http://en.people.cn/n3/2024/0626/c90000-20185859.html,"Home>>
		
Newly-developed neural probe achieves brain-wide neuronal activity recording in macaque brain in China
 (Xinhua) 13:08, June 26, 2024
BEIJING, June 26 (Xinhua) -- Chinese researchers have developed a high-density, 1,024-channel neural probe, achieving a full-depth recording of neuronal activities in the brain of a macaque monkey for the first time in the world.
The research team led by Duan Xiaojie at Peking University designed and produced the probe named Neuroscroll, which isolates single neuronal activities simultaneously from 1,024 densely spaced channels flexibly distributed across the probe.
The probe length is tunable from 1 cm to 10 cm, covering the brain sizes ranging from those of rodent species to primates.
The team used the probes to achieve simultaneous monitoring of the activities of over 700 single neurons covering the entire depth of the macaque monkey brain. In addition, they have realized stable neural recording in the rat brain for up to two years, demonstrating the excellent biocompatibility and long-term recording stability of the probe, said Duan.
The achievement was published online on Monday in the journal Nature Neuroscience.
Cheng Heping, director of the National Biomedical Imaging Center at Peking University, said that the breakthrough provides a powerful tool for simultaneously monitoring neuronal activities across multiple brain regions and exploring the relationship between neural activities and behavioral studies.
By implanting multiple probes, it will be possible to further achieve neural recordings from up to tens of thousands of channels, which will bring transformative impacts to basic neuroscience and translational neuroscience research, such as brain-machine interfaces, said Cheng.
(Web editor: Zhang Kaiwei, Zhong Wenxing)"
China-Romania joint lab for agriculture cooperation unveils in Bucharest,2024-06-26,http://en.people.cn/n3/2024/0626/c90000-20185850.html,"Home>>
		
China-Romania joint lab for agriculture cooperation unveils in Bucharest
 (Xinhua) 11:18, June 26, 2024

Elena Tatomir, general director of the Directorate General for Agricultural Policy at the Romanian Ministry of Agriculture and Rural Development, delivers a speech at the opening ceremony of the China-Romania Joint Laboratory for Cooperation in Agriculture in Bucharest, Romania, on June 25, 2024. The China-Romania Joint Laboratory for Cooperation in Agriculture was officially inaugurated on Tuesday at the University of Agronomic Sciences and Veterinary Medicine (UASVM) in Bucharest, aiming to enhance collaborative research in agricultural science and technological innovation. (Photo by Cristian Cristel/Xinhua)
BUCHAREST, June 25 (Xinhua) -- The China-Romania Joint Laboratory for Cooperation in Agriculture was officially inaugurated on Tuesday at the University of Agronomic Sciences and Veterinary Medicine (UASVM) in Bucharest, aiming to enhance collaborative research in agricultural science and technological innovation.
This joint initiative was built by the Institute of Environment and Sustainable Development in Agriculture under the Chinese Academy of Agricultural Sciences and the UASVM, with support from the Ministry of Science and Technology of China, the Chinese Embassy in Romania and the Romanian Ministry of Agriculture.
Wu Kongming, president of the Chinese Academy of Agricultural Sciences, hailed the laboratory's establishment as a significant milestone in China-Romania scientific cooperation, emphasizing its role in green agricultural development.
Elena Tatomir, general director of the Directorate General for Agricultural Policy at the Romanian Ministry of Agriculture and Rural Development highlighted the importance of this collaboration for the future of Romanian agriculture, particularly in greenhouse vegetable cultivation.
Chinese Ambassador to Romania Han Chunlin said the laboratory is a crucial achievement under the ""Belt and Road"" Science and Technology Innovation Action Plan, fostering deeper scientific, technological, and cultural exchanges between the two nations.
Han added that the laboratory has significantly impacted Central and Eastern Europe, supporting cultural exchanges, technology promotion, and production capacity cooperation.
UASVM Rector Sorin Cimpeanu and its Vice-Rector Florin Stanica both underlined the laboratory's role in advancing facility agricultural technologies and energy-saving solutions.
Since 2019, the initiative of the joint laboratory has completed various projects, including a plant factory with artificial light, a double-layer energy-saving greenhouse, and an edible fungus factory.

Participants visit a greenhouse at the opening ceremony of the China-Romania Joint Laboratory for Cooperation in Agriculture in Bucharest, Romania, on June 25, 2024. The China-Romania Joint Laboratory for Cooperation in Agriculture was officially inaugurated on Tuesday at the University of Agronomic Sciences and Veterinary Medicine (UASVM) in Bucharest, aiming to enhance collaborative research in agricultural science and technological innovation. (Photo by Cristian Cristel/Xinhua)

Sorin Cimpeanu (L), rector of the University of Agronomic Sciences and Veterinary Medicine, Wu Kongming (C), president of the Chinese Academy of Agricultural Sciences, and Chinese Ambassador to Romania Han Chunlin attend the opening ceremony of the China-Romania Joint Laboratory for Cooperation in Agriculture in Bucharest, Romania, on June 25, 2024. The China-Romania Joint Laboratory for Cooperation in Agriculture was officially inaugurated on Tuesday at the University of Agronomic Sciences and Veterinary Medicine (UASVM) in Bucharest, aiming to enhance collaborative research in agricultural science and technological innovation. (Photo by Cristian Cristel/Xinhua)

Sorin Cimpeanu, rector of the University of Agronomic Sciences and Veterinary Medicine, delivers a speech at the opening ceremony of the China-Romania Joint Laboratory for Cooperation in Agriculture in Bucharest, Romania, on June 25, 2024. The China-Romania Joint Laboratory for Cooperation in Agriculture was officially inaugurated on Tuesday at the University of Agronomic Sciences and Veterinary Medicine (UASVM) in Bucharest, aiming to enhance collaborative research in agricultural science and technological innovation. (Photo by Cristian Cristel/Xinhua)
(Web editor: Zhang Kaiwei, Liang Jun)"
