Title,Date,URL,Article
China's mountainous Yunnan adopts AI for power facility inspections,2024-03-13,http://en.people.cn/n3/2024/0313/c90000-20144505.html,"Home>>
		
China's mountainous Yunnan adopts AI for power facility inspections
 (Xinhua) 10:30, March 13, 2024
KUNMING, March 12 (Xinhua) -- China's southwestern province of Yunnan has deployed artificial intelligence (AI) to carry out most routine inspections at 621 power substations, replacing the need for human interventions.
The AI inspection, powered by cameras, drones and walking robots, is capable of completing a task in less than five minutes, down from the five hours required by human workers, according to the Yunnan branch of the China Southern Power Grid.
A major producer of hydropower and other forms of clean electricity, Yunnan has 1,937 power substations of 35 kilovolts or above, many of which are located in mountainous areas. Access to nearly half of these substations requires travel of more than three hours by road, said Wang Xin, a senior manager of the Yunnan branch.
AI-powered automatic inspections are expected to exempt human workers from lengthy road travels, thereby greatly reducing costs, according to Wang.
The China Southern Power Grid has planned to promote AI inspections to the rest of the substations in the province over the next two years.
China is increasingly turning to robotic technologies to tackle the shortage of technicians in remote mountainous areas. Last year, the mountainous province of Guizhou also started using robots for the inspection of power substations that are susceptible to disruptions by extreme weather conditions.
(Web editor: Zhang Kaiwei, Liang Jun)"
Experts call for more efforts in robotics,2024-03-13,http://en.people.cn/n3/2024/0313/c90000-20144501.html,"Home>>
		
Experts call for more efforts in robotics
By Wang Keju and Wu Yong (China Daily) 10:24, March 13, 2024

A Siasun employee conducts tests on a set of robotic arms at a production facility in Shenyang, Liaoning province, in August. [Photo/China Daily]
China should use targeted measures to develop its robotics industry further, focusing on key areas such as cutting-edge foundational technologies, the localization of critical components and enhancing the performance of overall applications, in order to stay competitive beyond its domestic market, said national legislators and industry analysts.
China has become a critical driving force for bolstering the development of the global robotics industry, said Zhang Jin, a deputy to the 14th National People's Congress and president of Liaoning province-based Siasun Robot and Automation Co, one of the largest robotics firms in the country.
The company has made big strides in autonomous robot controllers and validated servo motors and drivers. By demonstrating the capabilities and reliability of domestic industrial robot components, the company is helping to strengthen the country's position in the global robotics market, said Zhang.
Siasun has been conducting research and development of high-speed, high-load and high-precision industrial robot systems, so as to sharpen its competitive edge, Zhang added.
The industrial robot market in China experienced steady growth in 2023, with sales reaching 316,000 units, representing a year-on-year increase of 4.29 percent, according to a report released by the Gaogong Industry Research Institute.
A notable shift in market share between domestic and foreign manufacturers was seen last year. For the first time, domestic industrial robots accounted for more than half of the market, reaching a share of 52.45 percent, according to the report.
China has achieved a significant milestone in the industrial robot industry by developing a complete supply chain and achieving breakthroughs in core components, said Lu Hanchen, director of the institute.
With the ability to control costs, enhance product competitiveness, and foster collaboration between upstream and downstream partners, domestic industrial robot companies are well-positioned to dominate the market, Lu added.
In terms of functionality, domestic brands have shown remarkable progress, and their advantages lie in user-friendliness and the level of intelligence embedded in their products, Zhang said.
He added that hundreds of Siasun's robot models have been sold to over 40 countries and regions, serving more than 3,000 multinational corporations worldwide.
However, a lack of high-end applications is a crucial bottleneck hampering the industry's progress.
High-end applications, such as those in the semiconductor industry, require specialized robots capable of operating in vacuum environments. These robots play a vital role in ensuring the reliability and efficiency of manufacturing processes in sensitive industries, Zhang said.
Liaoning province's role as the cradle of China's robotics industry, coupled with its inherent advantages in academia, research, computing infrastructure and application scenarios, positions it as a stronghold for innovation in the robotics sector, Zhang said.
Going forward, it is imperative to support the establishment of a national technology innovation center in the northeastern region of China, so as to create an ecosystem that fosters collaboration and synergy among different elements of the innovation ecosystem including industry, funding and talent, Zhang added.
(Web editor: Tian Yi, Liang Jun)"
Researcher safeguards undersea garden against coral bleaching,2024-03-13,http://en.people.cn/n3/2024/0313/c90000-20144488.html,"Home>>
		
Researcher safeguards undersea garden against coral bleaching
 (Xinhua) 10:11, March 13, 2024

This photo taken with a mobile phone shows Luo Jie, an associate researcher from the Kunming Institute of Zoology, Chinese Academy of Sciences, collecting coral specimen in a laboratory of the institute in Kunming, southwest China's Yunnan Province, Jan. 17, 2024. (Xinhua/Yue Ranran)
KUNMING, March 12 (Xinhua) -- Luo Jie, an associate researcher from the Kunming Institute of Zoology, Chinese Academy of Sciences, is a keen diving enthusiast, which allows him to breed corals not only limited to his laboratory but also in real waters.
Luo still recalls the vast, colorful ""undersea forests"" he encountered nine years ago as a novice diver. However, the beautiful scenes have been long replaced by more and more pale coral ""graveyards.""
In the context of global warming, due to water quality changes and overfishing, one-fifth of the world's coral reefs have bleached and died since 2016, and the total area of coral reefs keeps shrinking according to scientists.
""Coral reefs cover less than 1 percent of the ocean, but shelter up to 25 percent of marine life. When coral reefs are destroyed, the marine environment is affected, and the marine life chain will be lost along with it,"" Luo said.
""Some scientists even predict that more than 70 percent of corals will bleach by 2030, and if nothing is done, all the reefs will be gone by 2050,"" he added.
How to keep corals from bleaching has then become his major subject. Luo began to focus on zooxanthellae, which can easily affect coral's life and death.
After five years of research and experiment, Luo designed a set of systems that can automatically control the physical and chemical environment of water and the type of biological community, which allows him to cultivate corals and fish in ""seawater"" simulated in his laboratory.
Mere restoring coral populations in the laboratory did not seem to satisfy the 38-year-old researcher.
In January 2020, Luo was invited to conduct some coral preservation research by a Chinese power plant in Bali, a renowned resort in Indonesia. Indonesia, with one of the world's richest coral reefs, is home to about 40,000 square kilometers of coral reefs, accounting for 16 percent of the world's total.
However, at that time, the local coral reefs north of Bali were bleaching and dying on a massive scale due to the El Nino weather pattern and overfishing. Luo and his team decided to transplant the corals underwater.
On June 8, 2023, about three years after their first experimental coral transplantation, Luo made a back-roll entry into the waters and directly swam towards their coral area. Thankfully, a vast expanse of corals of various colors greeted him, with abundant fish and shrimps living nearby.
Having confirmed that the corals have grown into strong ""coral trees,"" Luo knew they had passed Mother Nature's mock exam. He shared the good news with the local fishermen who thanked the Chinese researchers for their efforts to bring the undersea garden back to life.
On June 13, 2023, local fishermen and some Chinese enterprises and research institutes began their relay of transplanting some 100 corals to the designated waters.
""It is a real race, with stringent time and handover requirements,"" Luo said, adding that the fragile coral polyps, which corals are grown from, are extremely demanding on the living environment, and thus they need to accurately control the temperature and humidity during transportation, as even a slight bump may cause the coral animals to break and die. ""So every link, from land transportation, sea handover, to the final underwater planting, must be very careful.""
Though it was a long haul to stay underwater for seven hours each day at a water temperature less than 30 degrees Celsius and even get hurt from the aggressive triggerfish, Luo found his efforts paid off generously.
""An Indonesian fisherman in his 70s told me that in the 1970s, they had few employment opportunities and could only make money by digging corals and hunting fish which was brutal. But now everyone understands that there is no fish without corals and the locals have learnt to protect them thanks to the coral protection and breeding lectures given by our Chinese researchers,"" Luo said.
Back in his laboratory, Luo has bred more than 200 varieties of corals over the past 15 years, to help better select specific varieties when restoring the reefs.
He is also building a new laboratory to provide a germplasm pool for the species in case any subspecies become extinct some day. In the future, Luo hopes to make his own documentary, illustrating breeding and transplanting techniques for more people in detail, so that the undersea beauty would never fade again.

Luo Jie, an associate researcher from the Kunming Institute of Zoology, Chinese Academy of Sciences, conducts coral preservation research in Bali, a renowned resort in Indonesia in June 2023.(Xinhua)

Luo Jie, an associate researcher from the Kunming Institute of Zoology, Chinese Academy of Sciences, conducts coral preservation research in Bali, a renowned resort in Indonesia in June 2023.(Xinhua)
(Web editor: Zhang Kaiwei, Liang Jun)"
