Title,Date,URL,Article
Humanoid robot competition in Beijing draws visitors,2024-03-14,http://en.people.cn/n3/2024/0314/c90000-20145024.html,"Home>>
		
Humanoid robot competition in Beijing draws visitors
 (Ecns.cn) 11:18, March 14, 2024

A visitor interacts with a robot capable of conversation and facial expression control at the Humanoid Robot Competition held in the Beijing Economic-Technological Development Area, March 13, 2024. (Photo: China News Service)
The competition held on Wednesday attracted many visitors.

A contestant shows how a humanoid robot works at the Humanoid Robot Competition held in the Beijing Economic-Technological Development Area, March 13, 2024. (Photo: China News Service)

A tactile dexterous hand that can feel the pulse is displayed at the Humanoid Robot Competition held in the Beijing Economic-Technological Development Area, March 13, 2024. (Photo: China News Service)

A contestant shows how a humanoid robot works at the Humanoid Robot Competition held in the Beijing Economic-Technological Development Area, March 13, 2024. (Photo: China News Service)

A visitor interacts with a humanoid robot devoloped for accompanying at the Humanoid Robot Competition held in the Beijing Economic-Technological Development Area, March 13, 2024. (Photo: China News Service)

A robot transports items at the Humanoid Robot Competition held in the Beijing Economic-Technological Development Area, March 13, 2024. (Photo: China News Service)
(Web editor: Tian Yi, Liang Jun)"
"Technology empowers ancient city wall preservation, tourism innovation",2024-03-14,http://en.people.cn/n3/2024/0314/c90000-20145002.html,"Home>>
		
Technology empowers ancient city wall preservation, tourism innovation
 (Xinhua) 10:51, March 14, 2024
XI'AN, March 13 (Xinhua) -- Over the past few years, technology has played an increasingly important role in cultural heritage protection and the innovation of cultural tourism products in China. One of the beneficiaries of this trend is the Xi'an City Wall, China's largest and best-preserved ancient city wall.
Located at the heart of Xi'an, capital of the northwestern Shaanxi Province, the city wall was built as a military defense system over 600 years ago on the foundation of a prior structure dating back to the Sui and Tang dynasties (581-907). The wall is up to 14 meters wide at the top and consists of a series of military facilities, including watchtowers and crenels.
Bearing witness to history, the city wall also integrates seamlessly with modern urban life. Numerous tourists stroll on top of it or in the surrounding scenic area, while streams of vehicles pass through the city gates daily.
However, the city wall has experienced uneven settlement over the years, developing cracks and outward bulging in some parts. This produced the challenge of effectively preserving the ancient treasure without disrupting its modern functions. Conservation experts have responded to this challenge by seeking solutions via advanced technologies.
According to Su Ning, assistant director of the Xi'an City Wall Management Committee, over 3,000 monitoring spots have been set up along the wall complex, which has a circumference of 13.74 km. Nearly 2,400 of these monitoring spots keep track of wall settlement and more than 400 horizontal displacements.
Meanwhile, over 1,000 cameras have been installed at the city wall scenic area to detect real-time changes in visitor flow, water levels in the moat, and intrusion into prohibited areas, among others.
All monitoring data converge at the information center of the management committee and are displayed on large screens, said Su. Based on the data and the pattern of damage, the committee has set warning thresholds, while using different colors to represent different alert levels and implementing corresponding measures.
""Additionally, we have determined the city wall's static and dynamic load capacities, which are used to coordinate visitor flow to minimize the impact of tourism activities on the wall,"" said Su.
In 2023, muon imaging technology was used in a ""physical examination"" of the wall, marking the first application of this technology in relic conservation efforts in China.
Conducted by a research team from the School of Nuclear Science and Technology at Lanzhou University, muon imaging allows for high-precision scanning of the inside of the thick body of the wall to discover damage, without any harm to the wall -- in contrast with traditional methods.
Empowered by such technologies, conservation of the city wall has shifted from reactive repairs to proactive damage monitoring and prevention, Su noted.
Meanwhile, new ways of exploring the wall have emerged for visitors, with the rapid evolution of digital technologies giving birth to a diverse array of tourism products.
Upon entering the Xi'an City Wall scenic area, visitors can follow the guidance of a tour app that tells them the history of the city wall and shares stories concerning various attractions, while also indicating popular spots for taking photos.
Once visitors reach the area above the city wall's south gate, a 3-square-meter digital sand table vividly portrays the intricate layout of Chang'an City at the time when Xi'an was the capital of the Tang Dynasty (618-907), using state-of-the-art digital projection and visual effects to revive its glory days.
For those who cannot personally get there, a digital museum can offer an immersive tour of an archaeological research-themed museum inside the Xi'an City Wall. The museum houses the remains of the oldest part of the Xi'an City Wall -- a city gate built about 1,400 years ago, among other relics.
""Novel digital products can better evoke the public's fondness for history and culture,"" said Zhao Bin, director of the Xi'an City Wall Digital Industry Innovation Center, adding that the city wall scenic area had received over 8.5 million visitors in 2023.
In recent years, China has advocated a national cultural digitization strategy to invigorate the cultural sector and cultural industries. The implementation of this strategy is noted in this year's government work report delivered to the second session of the 14th National People's Congress.
The Xi'an City Wall will develop in line with the national cultural digitization strategy, strengthening collaboration with universities and enterprises to cement cultural relic preservation and cultural tourism, said Zhao.
(Web editor: Zhang Kaiwei, Liang Jun)"
Chinese researchers develop targeted nanomedicine for female Alzheimer's patients,2024-03-14,http://en.people.cn/n3/2024/0314/c90000-20144981.html,"Home>>
		
Chinese researchers develop targeted nanomedicine for female Alzheimer's patients
 (Xinhua) 10:28, March 14, 2024
TIANJIN, March 13 (Xinhua) -- Chinese researchers have developed a nanomedicine specifically for women with Alzheimer's disease.
A research team from Tianjin University's School of Life Sciences and the Tianjin Medical University General Hospital developed the nanomedicine, and the team's work has been published in the Nano Today journal.
Alzheimer's disease is a common neurodegenerative disorder characterized by the progressive degradation of memory and cognitive function. Studies have shown that women are at greater risk of developing Alzheimer's than men, and there is also a notable gender discrepancy in the progression of Alzheimer's, with rates of disease progression and mortality being two to three times higher among women.
Research has indicated that the significant decline in estrogen levels in women after menopause may be the reason women are at greater risk of developing Alzheimer's. Estrogen plays a vital role in safeguarding the female central nervous system, promoting neuronal growth and differentiation, and maintaining brain redox homeostasis by binding to specific receptors. Once women reach menopause, long-term estrogen deficiency induces neurodegeneration and aggravates cognitive decline.
The research team developed a multi-functional nanomedicine utilizing plant-derived estrogen glycyrrhetinic acid for the targeted treatment of postmenopausal female Alzheimer's disease. The nanomedicine is capable of activating neuroprotective signaling pathways mediated by specific estrogen receptors, thereby improving cognitive functions affected by estrogen deficiency.
The research team is now screening more precise nanomedicines for preclinical research.
(Web editor: Zhang Kaiwei, Liang Jun)"
EU lawmakers approve AI Act,2024-03-14,http://en.people.cn/n3/2024/0314/c90000-20144802.html,"Home>>
		
EU lawmakers approve AI Act
 (Xinhua) 08:35, March 14, 2024

People visit the Mobile World Congress (MWC) 2024 in Barcelona, Spain, Feb. 26, 2024. (Xinhua/Gao Jing)
The European Parliament on Wednesday approved the Artificial Intelligence (AI) Act with an overwhelming majority in Strasbourg, France.
BRUSSELS, March 13 (Xinhua) -- The European Parliament on Wednesday approved the Artificial Intelligence (AI) Act with an overwhelming majority in Strasbourg, France.
The Parliament passed the act with 523 lawmakers voting in favor, 46 against and 49 abstentions.
European Commissioner for the Internal Market Thierry Breton welcomed the result, saying that ""Europe is now a global standard-setter in AI.""
As the first-ever comprehensive legal framework on AI globally, the regulation has adopted a risk-based approach, subjecting higher-risk AI applications to stricter regulation.
Under the new rules, certain AI applications will be prohibited, including biometric categorization systems based on sensitive characteristics, and the untargeted scraping of facial images from the internet or CCTV footage for facial recognition databases.
Additionally, the Act prohibits emotion recognition in workplaces and schools, social scoring, predictive policing, and AI designed to manipulate human behavior or exploit vulnerabilities.
For general-purpose AI (GPAI) systems, the Act requires compliance with transparency requirements, such as adhering to European Union (EU) copyright laws and publishing detailed summaries of the content used for training.

People visit the Mobile World Congress (MWC) 2024 in Barcelona, Spain, Feb. 28, 2024. (Xinhua/Gao Jing)

A participant takes a photo during a forum on the theme of ""Computing Power Network: Smarter Network for a Smarter World"" during the Mobile World Congress 2024 in Barcelona, Spain, Feb. 27, 2024. (Xinhua/Gao Jing)
(Web editor: Zhang Kaiwei, Liang Jun)"
Scientist calls for observing sun from its polar orbit,2024-03-14,http://en.people.cn/n3/2024/0314/c90000-20144800.html,"Home>>
		
Scientist calls for observing sun from its polar orbit
By Zhao Lei (Chinadaily.com.cn) 08:32, March 14, 2024
Yang Mengfei, a distinguished spacecraft scientist and national political adviser, has called for government support for the research and development of a satellite capable of observing the sun from a solar polar orbit.
""The sun is the very star that created all life on Earth and has the biggest effect on humans. At the same time, solar activities are the root of many cosmic hazards that can disrupt human activities such as communications, power supply, air traffic and spacecraft operations,"" said Yang, a senior researcher at the China Academy of Space Technology and an academician at the Chinese Academy of Sciences.
Space powers such as the United States, Europe and Japan have launched more than 70 spacecraft dedicated to solar observation. China has also deployed its first solar observation satellite.
""However, all these satellites have observed the sun from the plane of the ecliptic, and so have only observed its equatorial regions in detail. In other words, no spacecraft has ever reached a solar polar orbit,"" Yang said.
""If we could place a satellite in a solar polar orbit, it would provide data to our scientists to help them better understand the origins of the solar magnetic activity cycle and high-speed solar wind, which have a great impact on human activities.""
Yang said Chinese researchers have had the idea of satellite observation in the solar polar orbit for many years, but it has so far just remained on paper.
""The country now has the solid scientific, technological and engineering foundations needed for sending a satellite to a solar polar orbit. So I suggest that the government start the spacecraft's design work and list the solar comprehensive exploration project as a key state program,"" said Yang, who is also a member of the 14th National Committee of the Chinese People's Political Consultative Conference, the country's top political advisory body.
He made the remarks on the sidelines of the annual session of the 14th CPPCC National Committee, which concluded in Beijing on Sunday.
China launched its first space-based solar telescope — the Chinese H-Alpha Solar Explorer, or Xihe (the sun goddess in ancient Chinese mythology) — in October 2021, aiming to use the spacecraft as a solar imaging spectrometer as well as a test bed for cutting-edge satellite technologies.
Since its orbital deployment, the spacecraft has carried out spectral scanning and imaging of the sun's H-Alpha waveband and has recorded the dynamics of solar activities in the star's photosphere and chromosphere.
The data has enabled scientists around the world to extensively advance their research of the sun and the solar system, according to the China National Space Administration.
(Web editor: Tian Yi, Liang Jun)"
"China unveils advanced AI model for medicine, boosting clinical diagnosis",2024-03-13,http://en.people.cn/n3/2024/0313/c90000-20144622.html,"Home>>
		
China unveils advanced AI model for medicine, boosting clinical diagnosis
 (Global Times) 15:10, March 13, 2024
A Hong Kong research center under the Chinese Academy of Sciences (CAS) has unveiled its latest artificial intelligence (AI) model for the healthcare industry, providing efficient clinical diagnosis and helping doctors in complex neurosurgery.
The development highlights the increasingly close academic collaboration between the Chinese mainland and Hong Kong, showcasing the country's leading position in the sector.
Developed by the Centre for Artificial Intelligence and Robotics (CAIR) of the CAS Hong Kong Institute of Science and Innovation, the CARES Copilot 1.0 model offers physicians enhanced accuracy in data retrieval. It can generate information and citations from academic sources, with data accuracy up to 95 percent, CAIR said on Monday.
Using the AI model for complement surgery, image navigation, and medical robotics in clinics, operating rooms and research institutes can directly assist medical staff in dealing with emergencies. They are able to provide supervision and early warnings and prevent risks during surgical procedures, Danny Chan Tat-ming, head of the neurosurgery division at the Department of Surgery in the Chinese University of Hong Kong, was quoted as saying.
The CARES Copilot system is designed to work with smart medical devices, providing trustable and explainable AI for surgery. It is able to process surgical data across modalities, including images, text, voice, video and ultrasound.
The performance of the Copilot 1.0 system was strictly tested using the challenging Zero-shot Top Token Selection standard, across five public datasets and two proprietary neurosurgical knowledge evaluation datasets, according to the research team of the CARES Copilot 1.0 AI model.
""We aim to integrate the Copilot 1.0 AI model with smart medical devices in the future, based on CAIR's achievements in medical robotics. The center is now collaborating with Prince of Wales Hospital in Hong Kong, Peking Union Medical College Hospital in Beijing, and the First Affiliated Hospital of Sun Yat-sen University in Guangzhou on these subjects,"" Xu Jun, a senior manager at the Centre for Artificial Intelligence and Robotics, told the Global Times on Tuesday.
The CARES Copilot 1.0 system exemplifies CAIR's unique position and academic background, reflecting the close academic cooperation between the Chinese mainland and Hong Kong.
According to CAIR's official website, the center was established under a memorandum of understanding signed between the Hong Kong SAR Government and the CAS. It is part of the Hong Kong Institute of Science and Innovation, the CAS' first affiliated branch outside of the Chinese mainland.
The Guangdong-Hong Kong-Macao Greater Bay Area is further advancing technological cooperation. In August 2023, China's State Council issued a plan to develop the Hetao Shenzhen-Hong Kong Science and Technology Innovation Cooperation Zone, aiming to deepen scientific and technological collaboration in the Greater Bay Area.
(Web editor: Tian Yi, Zhong Wenxing)"
Researchers uncover future variations of irrigation water use in China,2024-03-13,http://en.people.cn/n3/2024/0313/c90000-20144519.html,"Home>>
		
Researchers uncover future variations of irrigation water use in China
 (Xinhua) 10:55, March 13, 2024
BEIJING, March 12 (Xinhua) -- Researchers have developed a new method using machine learning and multiple data sets to estimate irrigation water use (IWU) across China, and also revealed how water use might change in the future based on different climate and economic scenarios.
Irrigated agriculture accounts for about 20 percent of global croplands and contributes more than 40 percent of food production. China is home to the world's largest irrigated farmland, accounting for over half of the country's arable lands.
Therefore, water for irrigation is critical to the crop growth and yields. Accurately characterizing changes in IWU is conducive to formulating optimal water resource allocation policies, particularly in the context of climate change.
However, due to limited data availability and model constraints, it is hard to use existing IWU estimation methods on a national scale or under future climate change scenarios.
The researchers from the Aerospace Information Research Institute under the Chinese Academy of Sciences developed a new machine-learning model to estimate nationwide IWU under a data-driven framework.
The new model integrated a range of high-precision hydrological satellite remote sensing products, meteorological drivers, economic statistics and numerical model simulations. It showed high precision in IWU projections with over 90 percent accuracy rate.
Taking a series of climate and socioeconomic scenarios into consideration, the researchers combined the established machine-learning framework with four advanced Earth system models to forecast the future trends and additional costs of IWU across China over the next 70 years.
Under different greenhouse gas emission scenarios, China's IWU is projected to increase in about 60 percent of provinces, especially in the northwest and northern regions.
IWU is also predicted to increase by 8.5 percent to 17.1 percent by 2050 compared to the historical period (1981-2010), with higher emissions leading to more significant increases.
This rise comes with an estimated additional cost of 1.65 to 3.91 billion U.S. dollars per year, highlighting the urgency for sustainable water management.
The research findings could provide crucial information for policymaking regarding agricultural water, contributing greatly to the sustainable use and management of water resources in the context of climate change and socioeconomic dynamics, the research team stated, adding that the results are also conducive for other countries confronted with increasing irrigation demands.
An article about this discovery was published in the journal Earth's Future.
(Web editor: Zhang Kaiwei, Liang Jun)"
Intelligent breeding platform launched in south China,2024-03-13,http://en.people.cn/n3/2024/0313/c90000-20144512.html,"Home>>
		
Intelligent breeding platform launched in south China
 (Xinhua) 10:45, March 13, 2024
HAIKOU, March 12 (Xinhua) -- The Chinese Academy of Agricultural Sciences (CAAS) has confirmed the launch of an intelligent breeding platform for breeding data processing.
The platform, jointly developed by the Hainan-based National Nanfan Research Institute (Sanya), the Institute of Crop Sciences under the CAAS and Alibaba's DAMO Academy, features world-leading data capacity, speed and data security measures.
It has realized integration of the whole breeding process, including breeding data management and analysis, optimization and acceleration of large model and large computing power, identification of suitable parents, and prediction of excellent varieties via an artificial intelligence algorithm.
High-throughput data analysis used in the breeding process requires huge computing power, modeling technology, complex command line operation skills, and various toolkits -- which is inconvenient for researchers to operate.
This meant that the development of a high-throughput computing platform with rich functionality, a friendly operation interface, and which relies on cloud services and artificial intelligence for precision breeding, was a priority.
The recently launched platform offers key features such germplasm resource information management, breeding experiment design and simulation, mass breeding omics data storage, high-throughput data analysis, and intelligent breeding decision-making.
It supports the integration and deep mining of large-scale omics information and phenotypic information data, said the CAAS.
Based on a self-developed breeding decision algorithm, the platform can accurately predict crop traits and identify excellent genotypes, which will improve the accuracy and efficiency of variety breeding.
The platform also uses an artificial intelligence algorithm to efficiently manage, schedule and analyze breeding big data, while the speed of operation of this process has been greatly improved.
To date, breeders from 23 research units around the world have used the platform, according to the CAAS.
The platform combines massive crop breeding data with an advanced big data algorithm, providing a new option for intelligent breeding, said Qian Qian, an academician of the Chinese Academy of Sciences.
(Web editor: Zhang Kaiwei, Liang Jun)"
China accelerating development of two large reusable rocket models,2024-03-13,http://en.people.cn/n3/2024/0313/c90000-20144509.html,"Home>>
		
China accelerating development of two large reusable rocket models
 (Xinhua) 10:41, March 13, 2024
BEIJING, March 12 (Xinhua) -- China's development of both 4-meter-diameter and 5-meter-diameter reusable rockets is being accelerated, with their inaugural flights scheduled for 2025 and 2026, respectively.
The manufacturing of these two new large reusable launching vehicle models is a response to growing demand in the commercial space market, said the China Aerospace Science and Technology Corporation.
Reusable rockets are crucial for future space exploration efforts, as they offer cost-effectiveness, high efficiency, technical complexity, and are also environmentally friendly.
""Despite the remaining technical challenges, the development of the two models brings us one step closer to the establishment of the commercial space launch market,"" said Wang Wei, head of the state-owned company's R&D department.
The commercial space industry in China is experiencing a period of rapid growth. According to a recent blue book on the country's aerospace science and technology environment, China managed to complete 26 commercial space launches in 2023 -- achieving a success rate of 96 percent. Additionally, a total of 120 commercial satellites were developed and launched, accounting for 54 percent of all satellites sent into orbit last year.
Furthermore, the construction of the No. 1 launch pad at an international commercial spacecraft launch site in Hainan Province has been completed, while the construction of the No. 2 launch pad is currently being accelerated. Each launch pad will have the capacity to carry out 16 missions per year.
The inclusion of the commercial space industry in this year's government work report has boosted confidence in the industry's development, Wang added.
Wang suggested that the commercial space industry should be nurtured, as it is one of the new quality productive forces which can contribute to the comprehensive development of China's space industry.
(Web editor: Zhang Kaiwei, Liang Jun)"
