Title,Date,URL,Article
China accelerates building of national computing power network,2023-12-27,http://en.people.cn/n3/2023/1227/c90000-20115263.html,"Home>>
		
China accelerates building of national computing power network
 (Xinhua) 08:47, December 27, 2023
BEIJING, Dec. 26 (Xinhua) -- China has released an implementation plan on further carrying out the ""east data, west computing"" project and speeding up the construction of a national computing power network, according to the national data bureau.
The plan, jointly released by five authorities including the bureau and the National Development and Reform Commission, aims to energize high-standard economic development with the development of high-quality computing power and contribute to the building of the country's cyberspace strength and a digital China.
By the end of 2025, China should form a preliminary comprehensive computing power infrastructure system. New computing power in national computing hubs should exceed 60 percent of the national new computing power, the computing power should be easier and cheaper to use, and key and core technologies should be basically safe and reliable, said the plan.
Work will be done to coordinate computing power among China's eastern, central and western regions, promote integrated application of computing power, data and algorithms, and coordinate the development and security of computing power, according to the plan.
(Web editor: Zhang Kaiwei, Liang Jun)"
Huawei revs up NEV sector with new SUV,2023-12-27,http://en.people.cn/n3/2023/1227/c90000-20115224.html,"Home>>
		
Huawei revs up NEV sector with new SUV
By Ma Si (China Daily) 08:32, December 27, 2023
Chinese tech giant aiming at cutting-edge autonomous driving features amid stiff rivalry
Huawei Technologies Co showcased its technological muscle in its latest SUV model on Tuesday, as the Chinese company aims to bring cutting-edge autonomous driving features to more cars amid stiff competition.
Huawei's efforts for new growth engines in the face of prolonged restrictions imposed by the United States have progressed further with its sustained push for the burgeoning new energy vehicle sector, experts said.
Yu Chengdong, head of Huawei's smart vehicle business unit, said at a product launch event in Shenzhen, Guangdong province, that it took three years for Huawei and Chinese carmaker Seres to codevelop the new Aito M9 SUV.
Yu said the Aito M9 features high-level autonomous driving technologies such as self-navigation on urban roads and expressways without reliance on high-definition maps, which are often considered a must for autonomous driving.
For long-haul trips, the system requires one manual intervention per 200 kilometers, and on urban roads, it can maneuver itself through fast traffic just like seasoned drivers, Yu said.
This is achieved in part by the vehicle's combination of 27 sensors, including high-definition cameras and lidar — a detection system that works like radar but uses laser light — to detect objects more accurately and swiftly, Huawei said.
Artificial intelligence technologies and object-detection networks are also leveraged to support high-level autonomous driving.
""Starting from the end of December, users will be able to turn on the M9's high-level autonomous driving functions when they are on urban roads and expressways across China,"" Yu said, adding that Huawei has already received 54,000 preorders for the SUV.
Donghai Securities said in a research note that autonomous driving technologies are entering a phase of rapid growth in China, as tech giants such as Huawei and auto startups such as Nio and Li Auto are bringing more advanced driving assistance systems to cars.
Cui Dongshu, secretary-general of the China Passenger Car Association, said there is enough room for the development of smart cars in the 5G era. Huawei can offer a slew of technological solutions and services covering both hardware and software.
Cui said that China's NEV sales in 2023 will reach the association's estimated figure of 8.5 million units, as many automakers — both startups and established companies — experience growing momentum.
Huawei's launch of its new model follows its splash in the NEV sector earlier this year. In November, more than 18,800 Aito vehicles were sold, up 127 percent year-on-year.
Last month, Huawei announced it would move its smart vehicle technologies and solutions into a joint venture with Chinese carmaker Changan, which will hold a stake of up to 40 percent in the joint venture.
Huawei said the equity stakes in the new joint venture will also be open to its existing partners and others of potential strategic value. Huawei has been codeveloping models with brands such as BAIC, JAC and Chery.
Zhong Shi, an independent auto analyst, said that Huawei has so far adopted two strategies to involve itself in the auto supply chain. One is for the supply of parts and technologies to automakers, like its cooperation with Changan.
""The other is the intelligent car selection mode. Huawei not only participates in product modeling, interior designing and intelligent solutions, but also is responsible for the marketing and sales of cars. A typical example is its cooperation with Seres, which has proved to be highly successful,"" Zhong said.
(Web editor: Tian Yi, Liang Jun)"
China launches new satellites to enhance BDS-3 services,2023-12-27,http://en.people.cn/n3/2023/1227/c90000-20115196.html,"Home>>
		
China launches new satellites to enhance BDS-3 services
 (Xinhua) 08:18, December 27, 2023

A Long March-3B carrier rocket and the Yuanzheng-1 (Expedition-1) upper stage attached to the carrier rocket, carrying two new satellites for the BeiDou-3 Navigation Satellite System (BDS-3), blast off from the Xichang Satellite Launch Center in southwest China's Sichuan Province, Dec. 26, 2023. The two satellites, the 57th and 58th satellites of the BeiDou system, were launched at 11:26 a.m. (Beijing Time). (Photo by Qiu Lijun/Xinhua)
XICHANG, Dec. 26 (Xinhua) -- China on Tuesday sent two new satellites for the BeiDou-3 Navigation Satellite System (BDS-3) into space successfully from the Xichang Satellite Launch Center in southwest China's Sichuan Province.
The two satellites, the 57th and 58th satellites of the BeiDou system, were launched at 11:26 a.m. (Beijing Time) by a Long March-3B carrier rocket and the Yuanzheng-1 (Expedition-1) upper stage attached to the carrier rocket.
They are the first medium-Earth orbit (MEO) satellites launched since BDS-3 was formally commissioned to provide satellite navigation services worldwide. After entering their orbit and completing in-orbit tests, they will be connected to the BeiDou system.
Compared to previous MEO satellites of the BeiDou system, the newly launched satellites have upgraded functions and performance in various areas, including global short message communication capacity, onboard atomic clock technology, and intelligent payloads.
They will upgrade the reliability and service capabilities of the BeiDou system. They will also lay the foundation for the development of next-generation BDS satellites.
The launch was the 504th mission for the Long March series carrier rockets.
The satellites and launch vehicle were respectively developed by the China Academy of Space Technology (CAST) and the China Academy of Launch Vehicle Technology, both of which are affiliated with the China Aerospace Science and Technology Corporation.
The two satellites will play multiple roles by effectively expanding the communication capacity of BeiDou's global short messages, upgrading the performance monitoring of the integrity of its navigation signals globally, and more, said Xie Jun, deputy chief designer of the BDS.
On July 31, 2020, China commissioned BDS officially, opening BDS-3 to global users, making China the third country around the world to have an independent global navigation satellite system.

A Long March-3B carrier rocket and the Yuanzheng-1 (Expedition-1) upper stage attached to the carrier rocket, carrying two new satellites for the BeiDou-3 Navigation Satellite System (BDS-3), blast off from the Xichang Satellite Launch Center in southwest China's Sichuan Province, Dec. 26, 2023. The two satellites, the 57th and 58th satellites of the BeiDou system, were launched at 11:26 a.m. (Beijing Time). (Photo by Qiu Lijun/Xinhua)

A Long March-3B carrier rocket and the Yuanzheng-1 (Expedition-1) upper stage attached to the carrier rocket, carrying two new satellites for the BeiDou-3 Navigation Satellite System (BDS-3), blast off from the Xichang Satellite Launch Center in southwest China's Sichuan Province, Dec. 26, 2023. The two satellites, the 57th and 58th satellites of the BeiDou system, were launched at 11:26 a.m. (Beijing Time). (Photo by Qiu Lijun/Xinhua)

A Long March-3B carrier rocket and the Yuanzheng-1 (Expedition-1) upper stage attached to the carrier rocket, carrying two new satellites for the BeiDou-3 Navigation Satellite System (BDS-3), blast off from the Xichang Satellite Launch Center in southwest China's Sichuan Province, Dec. 26, 2023. The two satellites, the 57th and 58th satellites of the BeiDou system, were launched at 11:26 a.m. (Beijing Time). (Photo by Qiu Lijun/Xinhua)
(Web editor: Zhang Kaiwei, Liang Jun)"
Top 10 Chinese scientific stories for 2023 unveiled: newspaper,2023-12-26,http://en.people.cn/n3/2023/1226/c90000-20115136.html,"Home>>
		
Top 10 Chinese scientific stories for 2023 unveiled: newspaper
 (Xinhua) 15:57, December 26, 2023
BEIJING, Dec. 26 (Xinhua) -- A Chinese newspaper unveiled a list of the country's top 10 scientific and tech stories for 2023, to sum up its advances in areas such as frontier science, biotechnology, space probe, and engineering.
The establishment of a central science and technology commission topped the list, according to Science and Technology Daily on Tuesday. The commission was set up to beef up the CPC Central Committee's centralized and unified leadership over science and technology-related work.
In space probe, China's orbiting Tiangong space station, which functions as a national space laboratory, has been put into operation.
The country's FAST telescope found key evidence for the existence of nanohertz gravitational waves, which can help solve puzzles in supermassive black holes, the history of galaxy mergers, and the formation of large-scale structures in the universe.
In biotechnology, Chinese scientists identified a key gene in a crop that might, via genetic engineering, substantially improve crop yields in alkaline soil.
Also, a team from Shenzhen constructed a high-resolution dynamic map of human prenatal immune system development across 18 gestational stages and 19 tissues, which offered promising avenues for potential therapeutic interventions.
In computing science, the quantum researchers from the University of Science and Technology of China generated a genuine entanglement up to 51 superconducting qubits. The team from Tsinghua University reported a fully integrated chip consisting of multiple memristor arrays and all the necessary peripheral circuits to support complete on-chip learning.
Among the country's engineering wonders in 2023 are the first commercial flight of its self-developed large passenger aircraft C919, the delivery of China's first domestically-built large cruise ship, the ""Adora Magic City,"" and the commercial operation of the Shidaowan high-temperature gas-cooled reactor (HTGR) nuclear power plant, the world's first fourth-generation nuclear power plant, according to the yearly selections.
(Web editor: Zhang Kaiwei, Liang Jun)"
China launches 3 satellites from sea,2023-12-26,http://en.people.cn/n3/2023/1226/c90000-20115011.html,"Home>>
		
China launches 3 satellites from sea
 (Xinhua) 13:06, December 26, 2023

A Long March-11 carrier rocket carrying three satellites blasts off from waters off the coast of Yangjiang, south China's Guangdong Province, Dec. 26, 2023. (Photo by Wang Keqi/Xinhua)
YANGJIANG, Guangdong, Dec. 26 (Xinhua) -- China on Tuesday successfully launched a Long March-11 carrier rocket into space, sending three satellites into planned orbit.
The Taiyuan Satellite Launch Center launched the rocket from waters off the coast of Yangjiang, south China's Guangdong Province, at 6:39 a.m. (Beijing Time).
The satellites, Shiyan-24C, will be mainly used for space science and technology experiments.
It was the 503rd mission of the Long March carrier rocket series.

A Long March-11 carrier rocket carrying three satellites blasts off from waters off the coast of Yangjiang, south China's Guangdong Province, Dec. 26, 2023. (Photo by Wang Keqi/Xinhua)

A Long March-11 carrier rocket carrying three satellites blasts off from waters off the coast of Yangjiang, south China's Guangdong Province, Dec. 26, 2023. (Photo by Wang Keqi/Xinhua)
(Web editor: Zhang Kaiwei, Liang Jun)"
900 MW photovoltaic project launched on Qinghai-Tibet Plateau,2023-12-26,http://en.people.cn/n3/2023/1226/c90000-20114999.html,"Home>>
		
900 MW photovoltaic project launched on Qinghai-Tibet Plateau
 (Xinhua) 11:20, December 26, 2023

This aerial photo taken on June 9, 2022 shows sheep walking through a photovoltaic power station in Gonghe County of Hainan Tibetan Autonomous Prefecture, northwest China's Qinghai Province. (Xinhua/Zhang Long)
XINING, Dec. 26 (Xinhua) -- A photovoltaic project with a power generation capacity of 900 MW went into operation on Sunday in northwest China's Qinghai Province.
It is the second-phase project for an ultra-high-voltage power line that transmits electricity from Qinghai to central China's Henan Province, according to China Three Gorges Corporation.
The photovoltaic project, located in Gonghe County of Hainan Tibetan Autonomous Prefecture, covers an area of about 1,540 hectares at an altitude of 3,000 meters in the northeast part of the Qinghai-Tibet Plateau, the corporation said.
This project will generate about 2.1 billion kWh of electricity on average a year, equivalent to saving about 640,000 tonnes of standard coal and reducing carbon dioxide emissions by 1.74 million tonnes.
Located on the Qinghai-Tibet Plateau, Qinghai is rich in clean energy resources, such as water, wind and solar power, making it an ideal place for the development of the new energy industry.
(Web editor: Zhang Kaiwei, Liang Jun)"
Global greenhouse gas reduction in paper industry requires diverse strategies: study,2023-12-26,http://en.people.cn/n3/2023/1226/c90000-20114987.html,"Home>>
		
Global greenhouse gas reduction in paper industry requires diverse strategies: study
 (Xinhua) 10:54, December 26, 2023
BEIJING, Dec. 25 (Xinhua) -- A group of researchers have assessed the net global greenhouse gas (GHG) emissions of domestic paper-related industries across 30 major countries from 1961 to 2019 and found significant differences in terms of historical emission evolution trends and structures in these countries, according to a recent study published in the journal Nature.
The pulp and paper industry is an important contributor to GHG emissions. Country-specific strategies are essential for the industry to achieve net-zero emissions by 2050, given its vast heterogeneities across countries, the study noted.
Researchers from the Department of Environmental Science and Engineering of Fudan University cooperated with international partners to set up a greenhouse gas emissions dataset concerning the paper industry and proposed a strategy to reach net-zero emission by 2050, which took into account the local conditions of countries.
The research showed that the global paper industry had emitted 43.5 billion tonnes of carbon dioxide equivalent of greenhouse gases from 1961 to 2019.
Net greenhouse gas emissions of the paper industry globally showed a tendency to rise first and then decline or stabilize.
All countries are expected to achieve net-zero emissions for their pulp and paper industries by 2050, with a single measure used for most developed countries and multiple measures employed for the majority of developing countries, according to the study.
The results of scenario analysis showed that improvements in both energy structures and energy efficiency are effective measures to reduce emissions, and which can achieve average emission reductions of 64 percent and 41 percent, respectively, across the 30 countries studied.
(Web editor: Zhang Kaiwei, Liang Jun)"
China's research icebreaker Xuelong 2 heads for Amundsen Sea for comprehensive scientific expedition,2023-12-26,http://en.people.cn/n3/2023/1226/c90000-20114720.html,"Home>>
		
China's research icebreaker Xuelong 2 heads for Amundsen Sea for comprehensive scientific expedition
 (Global Times) 08:36, December 26, 2023
China's domestically built polar icebreaker Xuelong 2, which is on the country's 40th Antarctic expedition, left Lyttelton Port in New Zealand on Monday afternoon after it completed material replenishment and personnel rotation, heading for the Amundsen Sea to carry out a comprehensive scientific expedition.
The icebreaker completed supply unloading and personnel boarding at the new Antarctic station being built in the Ross Sea area before arriving at the port after it set off from Shanghai on November 11. It also piloted the cargo ship Tianhui, which left from the city of Zhangjiagang in East China's Jiangsu Province and transported construction materials for the new research station.
Next, Xuelong 2 will head for the Amundsen Sea to carry out a comprehensive investigation and monitoring of biological ecology, water environment, sedimentary environment, atmospheric environment and pollutant distribution.
Organized by the Ministry of Natural Resources, China's 40th Antarctic expedition will carry out comprehensive surveys and monitoring to study the role of Antarctica in global climate change.
(Web editor: Tian Yi, Liang Jun)"
China's scientific achievements in 2023,2023-12-26,http://en.people.cn/n3/2023/1226/c90000-20114707.html,"Home>>
		
China's scientific achievements in 2023
 (Chinadaily.com.cn) 08:28, December 26, 2023
Chinese scientists have achieved a lot of breakthroughs in various fields, such as quantum computing, astronomical observation, and brain-computer interface in 2023. Let's review some of the highlights.

A QKD system that is able to generate secret keys at a record high SKR of 115.8 Mb/s over a 10 km standard optical fiber. [Photo/CCTV]
1. Chinese scientists set new record in high-rate quantum key distribution
Chinese scientists have developed a high-speed quantum key distribution system to generate secret keys at a rate exceeding 110 Mb/s over a 10 km standard optical fiber, setting a new world record in the field.
The achievement is of great significance to the large-scale application of quantum communication and quantum network, according to Xu Feihu, a professor at the University of Science and Technology of China.
 
2. Chinese scientists develop first superionic hydride ion conductor at ambient conditions
Chinese scientists have developed the first superionic hydride ion conductor at ambient conditions, according to the Dalian Institute of Chemical Physics of the Chinese Academy of Sciences.
With strong reducibility and high redox potential, the hydride ion (H-) is a reactive hydrogen species and an energy carrier. Materials that conduct pure H- at ambient conditions will be enablers of advanced clean energy storage and electrochemical conversion technologies.
 
3. China completes world's first brain-computer interface experiment on primate subject
China has successfully conducted the world's first brain-computer interface experiment on a non-human primate in Beijing.
The experiment successfully implemented a brain-computer interface in monkeys, allowing them to control a robotic arm with their thoughts. The experiment's success has positioned China as a front-runner in the technology.
Experiment offers hope for robotic limbs
 
4. Scientists grow human kidneys in pig embryos
A Chinese team has grown, for the first time in the world, kidneys from human stem cells inside pig embryos.
The advance that brings pig-grown human organs closer to reality will open an exciting avenue for kidney transplants and a new window for studying human kidney development, according to a study published in the journal Cell Stem Cell.
 

This photo shows the image of Andromeda as seen through the Wide Field Survey Telescope Mozi. [Photo/Xinhua]
5. China releases first image captured by new wide-field survey telescope
A wide-field telescope capable of surveying the entire Northern Hemisphere sky was put into operation on Sept 17, 2023, in Northwest China's Qinghai province, and its first image -- the Andromeda Galaxy, located over 2 million light-years away -- has already been released.
Developed by the University of Science and Technology of China and the Purple Mountain Observatory of the Chinese Academy of Sciences, the Wide Field Survey Telescope is now the largest time-domain survey facility in the Northern Hemisphere.
 
6. Chinese scientists report first live birth of chimeric monkey
A team of Chinese scientists has confirmed the first live birth of a monkey that contains a high proportion of cells derived from a monkey stem cell line, which paves the way for scientists to use chimeric primates to study human diseases.
The experiment demonstrated that the monkey stem cells, a type of cell able to develop into many different cell types, could efficiently contribute to placental tissues outside the embryo and germ cells.
(Web editor: Tian Yi, Liang Jun)"
"From cars to smart homes, AI is changing everything",2023-12-26,http://en.people.cn/n3/2023/1226/c90000-20114682.html,"Home>>
		
From cars to smart homes, AI is changing everything
 (Chinadaily.com.cn) 08:13, December 26, 2023
This year, the ChatGPT, or Chat Generative Pre-trained Transformer, set off a new wave of artificial intelligence usage. As generative artificial intelligence is more and more used widely, the technology is generating a buzz in the world.
Especially, the large language model breakthrough and the generative AI provide advanced production tools for enterprises to achieve product and process innovation, lead enterprises and industries into a new stage of intelligent innovation, as well as change people's work and life.
Business magazine Forbes said the global AI market size is projected to expand at a compound annual growth rate of 37.3 percent from 2023 to 2030, and is expected to contribute $15.7 trillion to the global economy by 2030.
Another report from the market consultancy IDC said China's AI market size will reach $14.75 billion in 2023, with the figure expected to hit $26.44 billion in 2026.
Let's take a look at how AI is changing people's lives.
 
Smart homes
The AI recognized order is widely used in smart devices that interact with people, such as smart homes.
In a smart home, people can give verbal instructions to control household appliances, including the air-conditioner to adjust temperature, curtains to open or close, light to turn on or off, robotic vacuum cleaner to operate, as well as the audio-visual entertainment system.
 
Intelligent customer service
The AI is used to create recommendation based on people's browsing history at some content platforms, or provide pre-sales consultation and after-sales services on the online shopping platforms.
 
Education
Based on technologies of text recognition and general natural language processing, AI can quickly and accurately identify images, text, and various functional areas, and through deep learning, repeated training and correcting to adjust its thinking and judgment logic, as well as teach the AI some ""standards"" to grade paperwork, and summarize error-prone contents to enhance their teaching efficiency and quality.
In China, some driving schools are using AI training system to simulate the real driving scene, and give strict and precise instructions to help the trainee learn driving skills.
 
Autonomous vehicles
The AI is used to build self-driving car to improve the in-vehicle experience and provide additional systems such as emergency braking, blind-spot monitoring, and driver-assisted steering.
Nowadays, some companies such as Tesla, Baidu, and Huawei have used machine learning to train computers to think and evolve like humans when it comes to driving in any environment and object detection to avoid accidents.
 
Text and picture processing
As AI continues to improve to comprehend natural language and images, it can effectively resolve customer issues and respond inquiries to provide 24/7 support.
Currently, the AIGC, or AI-generated content tool, can be used in chatting, translation, writing, picture processing and so on.
 
Healthcare
The AI finds diverse applications in the healthcare sector, such as helping detect diseases, identifying cancer cells, and using the combination of historical data and medical intelligence for the discovery of new drugs.
Recently, doctors at the Chongqing University Cancer Hospital worked with the AI team to complete a thyroid tumor resection. During the surgical planning, the AI automatically identified the lesions, and provided multidimensional information such as 3D reconstruction of the surgical area.
(Web editor: Tian Yi, Liang Jun)"
