Title,Date,URL,Article
All Shenzhou-17 astronauts out of return capsule,2024-05-01,http://en.people.cn/n3/2024/0501/c90000-20163930.html,"Home>>
		
All Shenzhou-17 astronauts out of return capsule
 (Xinhua) 10:12, May 01, 2024

The return capsule of the Shenzhou-17 manned spaceship, carrying astronauts Tang Hongbo, Tang Shengjie and Jiang Xinlin, touches down at the Dongfeng landing site in north China's Inner Mongolia Autonomous Region, April 30, 2024. The three astronauts are all in good health condition, according to the China Manned Space Agency. (Xinhua/Bei He)
JIUQUAN, April 30 (Xinhua) -- The three astronauts of the Shenzhou-17 manned mission -- Tang Hongbo, Tang Shengjie and Jiang Xinlin -- were all out of the return capsule that touched down at the Dongfeng landing site in north China's Inner Mongolia Autonomous Region on Tuesday.
They are in good physical condition, and the mission is a complete success, according to the China Manned Space Agency.

The return capsule of the Shenzhou-17 manned spaceship, carrying astronauts Tang Hongbo, Tang Shengjie and Jiang Xinlin, touches down at the Dongfeng landing site in north China's Inner Mongolia Autonomous Region, April 30, 2024. The three astronauts are all in good health condition, according to the China Manned Space Agency. (Xinhua/Li Zhipeng)

The return capsule of the Shenzhou-17 manned spaceship, carrying astronauts Tang Hongbo, Tang Shengjie and Jiang Xinlin, touches down at the Dongfeng landing site in north China's Inner Mongolia Autonomous Region, April 30, 2024. The three astronauts are all in good health condition, according to the China Manned Space Agency. (Xinhua/Lian Zhen)

The return capsule of the Shenzhou-17 manned spaceship, carrying astronauts Tang Hongbo, Tang Shengjie and Jiang Xinlin, is about to touch down at the Dongfeng landing site in north China's Inner Mongolia Autonomous Region, April 30, 2024. The three astronauts are all in good health condition, according to the China Manned Space Agency. (Xinhua/Lian Zhen)

The return capsule of the Shenzhou-17 manned spaceship, carrying astronauts Tang Hongbo, Tang Shengjie and Jiang Xinlin, touches down at the Dongfeng landing site in north China's Inner Mongolia Autonomous Region, April 30, 2024. The three astronauts are all in good health condition, according to the China Manned Space Agency. (Xinhua/Lian Zhen)
The return capsule of the Shenzhou-17 manned spaceship, carrying astronauts Tang Hongbo, Tang Shengjie and Jiang Xinlin, touches down at the Dongfeng landing site in north China's Inner Mongolia Autonomous Region, April 30, 2024. The three astronauts are all in good health condition, according to the China Manned Space Agency. (Xinhua/Lian Zhen)

Astronaut Tang Hongbo is out of the return capsule of the Shenzhou-17 manned spaceship at the Dongfeng landing site in north China's Inner Mongolia Autonomous Region, April 30, 2024. The return capsule of the Shenzhou-17 manned spaceship, carrying astronauts Tang Hongbo, Tang Shengjie and Jiang Xinlin, touched down at the Dongfeng landing site in north China's Inner Mongolia Autonomous Region on Tuesday. The three astronauts are all in good health condition, according to the China Manned Space Agency. (Xinhua/Bei He)

Astronaut Jiang Xinlin is out of the return capsule of the Shenzhou-17 manned spaceship at the Dongfeng landing site in north China's Inner Mongolia Autonomous Region, April 30, 2024. The return capsule of the Shenzhou-17 manned spaceship, carrying astronauts Tang Hongbo, Tang Shengjie and Jiang Xinlin, touched down at the Dongfeng landing site in north China's Inner Mongolia Autonomous Region on Tuesday. The three astronauts are all in good health condition, according to the China Manned Space Agency. (Xinhua/Bei He)

Astronaut Tang Shengjie is out of the return capsule of the Shenzhou-17 manned spaceship at the Dongfeng landing site in north China's Inner Mongolia Autonomous Region, April 30, 2024. The return capsule of the Shenzhou-17 manned spaceship, carrying astronauts Tang Hongbo, Tang Shengjie and Jiang Xinlin, touched down at the Dongfeng landing site in north China's Inner Mongolia Autonomous Region on Tuesday. The three astronauts are all in good health condition, according to the China Manned Space Agency. (Xinhua/Bei He)

Astronaut Tang Hongbo is out of the return capsule of the Shenzhou-17 manned spaceship at the Dongfeng landing site in north China's Inner Mongolia Autonomous Region, April 30, 2024. The return capsule of the Shenzhou-17 manned spaceship, carrying astronauts Tang Hongbo, Tang Shengjie and Jiang Xinlin, touched down at the Dongfeng landing site in north China's Inner Mongolia Autonomous Region on Tuesday. The three astronauts are all in good health condition, according to the China Manned Space Agency. (Xinhua/Lian Zhen)

Astronaut Jiang Xinlin is out of the return capsule of the Shenzhou-17 manned spaceship at the Dongfeng landing site in north China's Inner Mongolia Autonomous Region, April 30, 2024. The return capsule of the Shenzhou-17 manned spaceship, carrying astronauts Tang Hongbo, Tang Shengjie and Jiang Xinlin, touched down at the Dongfeng landing site in north China's Inner Mongolia Autonomous Region on Tuesday. The three astronauts are all in good health condition, according to the China Manned Space Agency. (Xinhua/Lian Zhen)

Astronaut Tang Shengjie is out of the return capsule of the Shenzhou-17 manned spaceship at the Dongfeng landing site in north China's Inner Mongolia Autonomous Region, April 30, 2024. The return capsule of the Shenzhou-17 manned spaceship, carrying astronauts Tang Hongbo, Tang Shengjie and Jiang Xinlin, touched down at the Dongfeng landing site in north China's Inner Mongolia Autonomous Region on Tuesday. The three astronauts are all in good health condition, according to the China Manned Space Agency. (Xinhua/Bei He)

This combo photo taken on April 30, 2024 shows the return capsule of the Shenzhou-17 manned spaceship carrying astronauts Tang Hongbo, Tang Shengjie and Jiang Xinlin, touching down at the Dongfeng landing site in north China's Inner Mongolia Autonomous Region, April 30, 2024. The three astronauts are all in good health condition, according to the China Manned Space Agency. (Xinhua/Lian Zhen)
(Web editor: Cai Hairuo, Kou Jie)"
Digital and Intelligent Asia-Pacific Congress 2024 held in Bangkok,2024-05-01,http://en.people.cn/n3/2024/0501/c90000-20163921.html,"Home>>
		
Digital and Intelligent Asia-Pacific Congress 2024 held in Bangkok
 (Xinhua) 09:57, May 01, 2024
BANGKOK, April 30 (Xinhua) -- Chinese technology giant Huawei and the ASEAN Foundation jointly hosted the Digital and Intelligent Asia-Pacific Congress 2024, seeking to explore digital transformation opportunities and promote digital development in the region.
Scheduled from Monday to Tuesday, the event attracted more than 2,000 participants in both the public and private sectors from 15 Asia-Pacific countries and regions to discuss the deployment of leading digital and intelligent infrastructure as well as promote the integrated development of the digital and real economies.
In her opening speech via video message, Meng Wanzhou, deputy chairwoman of the board and CFO of Huawei, said Asia-Pacific has become a role model for other regions that are trying to go digital and grow their digital economies.
With over 1 trillion Chinese yuan invested in research and development, Huawei will continue its focus on creating value for customers and openly collaborate with partners to bring the benefits of digital and intelligent technologies to people in Asia-Pacific, Meng said.
As home to over 480 million active Internet users, the Association of Southeast Asian Nations (ASEAN) recognizes the transformative power of digital technologies and embraces them as a new driver for growth, said Nararya S. Soeprapto, deputy secretary-general of ASEAN.
Thailand is prioritizing digital transformation through the national growth engine policy, which aims to develop the digital economy as a key driver for enhancing competitiveness, said Thai Minister of Digital Economy and Society Prasert Jantararuangtong.
(Web editor: Cai Hairuo, Kou Jie)"
Chinese researchers start 2024 Arctic expedition at Yellow River Station,2024-05-01,http://en.people.cn/n3/2024/0501/c90000-20163913.html,"Home>>
		
Chinese researchers start 2024 Arctic expedition at Yellow River Station
 (Xinhua) 09:39, May 01, 2024

This photo taken by a mobile phone on April 30, 2024 shows China's Yellow River Station at Ny-Alesund in Svalbard, a Norwegian archipelago in the Arctic Ocean. Three Chinese researchers arrived at China's Yellow River Station in the Arctic on Monday to conduct a variety of scientific surveys across the region over the year. (Chinese Arctic expedition team/Handout via Xinhua)
OSLO, April 30 (Xinhua) -- Three Chinese researchers arrived at China's Yellow River Station in the Arctic on Monday to conduct a variety of scientific surveys across the region over the year.
Hu Zhengyi, head of the Yellow River Station, told Xinhua that the station expects to host over 50 researchers this year, who will engage in seasonal expeditions spanning four quarters.
Post-pandemic expeditions at the Yellow River Station have resumed gradually since last July, during which team members have carried out a range of operational surveys and scientific research projects in the fields of glaciology, terrestrial and marine ecology and space physics.
Chinese and Norwegian scientists have also jointly undertaken studies on environmental pollutants in the Arctic.
Established in July 2004, the Yellow River Station is China's first Arctic research station, located in Ny-Alesund, a small town in Svalbard, a Norwegian archipelago in the Arctic Ocean.
In recent years, China has successfully carried out multiple Arctic scientific expeditions using platforms such as the polar icebreakers ""Xuelong"" and ""Xuelong 2,"" the Arctic Yellow River Station and the China-Iceland Arctic Science Observatory.

This photo taken by a mobile phone on April 30, 2024 shows members of Chinese Arctic expedition team posing for photos in front of China's Yellow River Station at Ny-Alesund in Svalbard, a Norwegian archipelago in the Arctic Ocean. Three Chinese researchers arrived at China's Yellow River Station in the Arctic on Monday to conduct a variety of scientific surveys across the region over the year. (Chinese Arctic expedition team/Handout via Xinhua)

This photo taken by a mobile phone on April 30, 2024 shows China's Yellow River Station at Ny-Alesund in Svalbard, a Norwegian archipelago in the Arctic Ocean. Three Chinese researchers arrived at China's Yellow River Station in the Arctic on Monday to conduct a variety of scientific surveys across the region over the year. (Chinese Arctic expedition team/Handout via Xinhua)
(Web editor: Cai Hairuo, Kou Jie)"
Chinese astronauts return safely with six-month space station mission accomplished,2024-05-01,http://en.people.cn/n3/2024/0501/c90000-20163905.html,"Home>>
		
Chinese astronauts return safely with six-month space station mission accomplished
By Zhang Dan, Yi Ling, Quan Xiaoshu (Xinhua) 09:21, May 01, 2024
* Shenzhou-17's return capsule, carrying astronauts Tang Hongbo, Tang Shengjie and Jiang Xinlin, touched down at the Dongfeng landing site in north China's Inner Mongolia Autonomous Region at 5:46 p.m. (Beijing Time).
* The three astronauts, after staying in orbit for 187 days, are all in good health and the Shenzhou-17 manned mission was a success.
* The Shenzhou-17 crew carried out 84 space application experiments and tests in orbit, and produced more than 200 samples covering multiple fields, including space life science and biotechnology, space medicine and space material science.
JIUQUAN, April 30 (Xinhua) -- The three Shenzhou-17 astronauts returned to Earth safely on Tuesday afternoon, after completing a six-month space station mission.
Shenzhou-17's return capsule, carrying astronauts Tang Hongbo, Tang Shengjie and Jiang Xinlin, touched down at the Dongfeng landing site in north China's Inner Mongolia Autonomous Region at 5:46 p.m. (Beijing Time), and the crew all left the return capsule by 6:37 p.m., according to the China Manned Space Agency (CMSA).

The return capsule of the Shenzhou-17 manned spaceship, carrying astronauts Tang Hongbo, Tang Shengjie and Jiang Xinlin, is about to touch down at the Dongfeng landing site in north China's Inner Mongolia Autonomous Region, April 30, 2024. (Xinhua/Li Zhipeng)
The three astronauts, after staying in orbit for 187 days, are all in good health and the Shenzhou-17 manned mission was a success, the CMSA said.
Tang Hongbo has accumulated a total of 279 days in space over the course of two missions, Shenzhou-12 and Shenzhou-17, setting a new record for the longest spaceflight duration by a Chinese astronaut. His experience has been invaluable to regular crew rotations and spaceflight mission training, according to the CMSA.
""I am proud and honored for my motherland,"" the 48-year-old mission commander said, sitting in front of the capsule. ""While completing my tasks, I missed my motherland and hometown very much.""

Astronaut Tang Hongbo is out of the return capsule of the Shenzhou-17 manned spaceship at the Dongfeng landing site in north China's Inner Mongolia Autonomous Region, April 30, 2024. (Xinhua/Bei He)
Tang Shengjie, 34, who has just completed his first space trip and is the youngest astronaut to have entered China's space station, said that the six months had been a journey of learning and exploration, during which he gained a lot of valuable experience. ""I believe that fulfilling my dream of flying into space was not an endpoint but a new start.""

Astronaut Tang Shengjie is out of the return capsule of the Shenzhou-17 manned spaceship at the Dongfeng landing site in north China's Inner Mongolia Autonomous Region, April 30, 2024. (Xinhua/Bei He)
Jiang, 36, who has also just finished his first spaceflight, said, ""Now that I am back in the embrace of our motherland, my heart is filled with excitement. In the coming days, I will continue to work diligently on the recovery tasks and strive to return to space as soon as possible.""

Astronaut Jiang Xinlin is out of the return capsule of the Shenzhou-17 manned spaceship at the Dongfeng landing site in north China's Inner Mongolia Autonomous Region, April 30, 2024. (Xinhua/Bei He)
The return capsule separated from Shenzhou-17's orbital capsule at 4:56 p.m. Then the brake engine ignited, and the return capsule separated from the propulsion capsule, the CMSA said.
Soon after the return capsule landed, the ground search team arrived at the landing site.
China launched the Shenzhou-17 manned spaceship on Oct. 26, 2023. It was the second crewed mission for the application and development stage of China's space station.
The Shenzhou-17 crew carried out 84 space application experiments and tests in orbit, and produced more than 200 samples covering multiple fields, including space life science and biotechnology, space medicine and space material science, said Lin Xiqiang, deputy director of the CMSA, at a press conference on April 24.
Scientists will conduct further in-depth analysis of and research on these samples, aiming to achieve significant scientific application results in areas such as the preparation of high-performance multivariant alloys and functional crystal materials, and the inhibition of bone loss through the differentiation of stem cells.

This screen image captured at Beijing Aerospace Control Center on March 2, 2024 shows Shenzhou-17 astronaut Tang Hongbo performing extravehicular activities. (Xinhua/Li He)
""In addition, the Shenzhou-17 mission also saw Chinese astronauts complete the first in-orbit maintenance of extravehicular facilities, fully showcasing the role of humans in addressing unforeseen issues encountered in space,"" Lin said.
The space station's core module, Tianhe, had previously suffered a partial loss of power supply due to the impact of space debris on the solar wing's power cables.
The Shenzhou-17 crew, in two extravehicular activities, completed maintenance work on the Tianhe core module's solar wings, solving the impact problem, according to Lin.
China launched the Shenzhou-18 manned spaceship on April 25, sending three astronauts -- Ye Guangfu, Li Cong and Li Guangsu -- to its space station for another six-month mission.
(Web editor: Cai Hairuo, Kou Jie)"
Shenzhou-17 orbital capsule separates from return capsule,2024-04-30,http://en.people.cn/n3/2024/0430/c90000-20163884.html,"Home>>
		
Shenzhou-17 orbital capsule separates from return capsule
 (Xinhua) 17:00, April 30, 2024
JIUQUAN, April 30 (Xinhua) -- The orbital capsule of the Shenzhou-17 manned spaceship separated from the return capsule successfully on Tuesday, according to the China Manned Space Agency.
(Web editor: Zhang Kaiwei, Zhong Wenxing)"
Sci-tech innovation empowers modern coal industry in NW China's Ningxia,2024-04-30,http://en.people.cn/n3/2024/0430/c90000-20163851.html,"Home>>
		
Sci-tech innovation empowers modern coal industry in NW China's Ningxia
 (Xinhua) 16:19, April 30, 2024
YINCHUAN, April 30 (Xinhua) -- At the sample exhibition hall of the Ningdong Industrial Park of Tayho Advanced Materials Co., Ltd. in Yinchuan, capital of northwest China's Ningxia Hui Autonomous Region, visitors are captivated by a range of spandex-crafted products, including sportswear, underwear, and baby diapers.
""Such remarkable elasticity,"" said visitors as they tugged on a spandex product.
Spandex, a synthetic fiber known for its exceptional elasticity, boasts properties like high elongation, resilience, and fatigue resistance. Widely utilized in textile garments, medical applications, and automotive interiors, among other fields, spandex stands as a top-tier textile material with comprehensive performance.
But it is all the more astonishing to learn that this white, stretchable textile material originates from the depths of black coal.
""Through a series of coal chemical processes and chemical reactions, coal metamorphoses into spandex,"" said Zhang Guojun, manager of the production department of Ningxia Ningdong Advanced Materials Co., Ltd.
He said that when it comes to producing various types of spandex, Tayho's technology in the industry is at the forefront.
Walking into the company's spinning workshop, one could witness machines deftly winding spandex filaments, each thinner than a human hair, onto paper tubes. Despite the bustling machinery, few workers are visible.
""Previously, a single production line required three workers; now, one suffices. We aim to produce 30,000 tonnes of spandex filaments annually for downstream enterprises,"" said Li Xile, director of the second workshop of the company.
The ongoing automation enhancements and the pioneering technology for converting coal into fibers of the spandex producer offer a glimpse into Ningxia's concerted efforts in propelling its modern coal chemical industry forward.
By nurturing new quality productive forces, Tayho's line of products does not stop at daily clothing. In addition to spandex, the company's repertoire includes aramid, a kind of white fiber also stemming from coal.
Aramid fiber, revered for its flame resistance, high-temperature tolerance, and remarkable strength and modulus, finds applications in diverse realms. From flame-retardant protective clothing to critical components in aerospace and transportation vehicles, Tayho fully exploits the fiber's versatility.
""We've achieved some breakthroughs in the traditional textile sector, disrupting the norms within our supply chain, and are gradually broadening our product line. These advancements are proving to be significant catalysts for our enterprise's high-quality development,"" Zhang said.
""Through a series of our research endeavors, we have infused our company with fresh vitality and energy,"" he added, pointing out that the innovative actions enabled Tayho to fill the void in Ningxia's high-performance fiber industry, positioning the region as a contributor to modern coal utilization.
(Web editor: Zhang Kaiwei, Zhong Wenxing)"
China actively addresses global health challenges through innovation,2024-04-30,http://en.people.cn/n3/2024/0430/c90000-20163782.html,"Home>>
		
China actively addresses global health challenges through innovation
 (Xinhua) 15:29, April 30, 2024
BEIJING, April 30 (Xinhua) -- A surgical robot capable of peeling a raw quail egg made a splash at the recently concluded 2024 Zhongguancun Forum in Beijing.
""It is a robot for single-port endoscopic surgery, and it can be used for urological and gynecological operations,"" said Hu Shiyou, an employee of Beijing Surgerii Robotics Co., Ltd., the robot's developer.
Increasingly digitized operating rooms, as well as the application of surgical robots and artificial intelligence (AI) systems, contribute to improving surgical precision, according to Zhang Qiang, chairman and co-chief executive officer of Shanghai United Imaging Healthcare Co., Ltd.
""Based on the innovative technology, we are exploring the establishment of a new ecosystem covering disease prevention, diagnosis, treatment and recovery stages,"" Zhang said.
Barry Marshall, Nobel laureate in physiology or medicine and a foreign academician at the Chinese Academy of Engineering, emphasized the importance of basic research in the development of medical science and technology, which promotes medical technology innovation.
Take the development of thoracic surgery as an example. There have been two major breakthroughs in the field over the past century -- a lung cancer patient who was cured through surgery in the 1930s, and the use of a thoracoscope in the early 1990s, according to Wang Jun, head of Peking University People's Hospital.
""Today, nearly 90 percent of lung cancer operations in China can be conducted by thoracoscope,"" said Wang, adding that the hospital is cooperating with experts in the AI field to assist in surgery.
Chen Jiachang, vice minister of science and technology, noted that promoting innovative research and development, including basic research, can lead to more efficient and accurate treatment methods, more convenient and intelligent health management solutions, and the accelerated development of drugs and vaccines.
In recent years, the world has faced health challenges. Liang Wannian, dean of the Institute for Healthy China at Tsinghua University, said that it is vital to deal with the threat of infectious diseases, chronic diseases and aging issues, and enhance our capabilities to prevent future epidemics or pandemics.
""I could say that the health system in China is very good and the science is good,"" Marshall said in a recent interview with Xinhua. ""When I talk to medical scientists in China, everybody is thinking about the same problems in cancer, infectious disease, epidemiology, viruses, and trying to innovate.""
""I can see how quickly China has improved, and the top universities in China are really world-class. We have to emphasize the top universities, hospitals and institutions need to keep a high scientific standard,"" he added.
Yu Yingjie, a member of the Standing Committee of the Communist Party of China Beijing Municipal Committee, said that a number of biopharmaceutical companies are developing at rapid speeds in Beijing's Changping District and Yizhuang area.
""Researchers at top universities and institutions are now concentrating on technology transfers,"" Yu said.
He noted that Beijing will coordinate with partners around the world to put forward new technologies, products and innovative modes in life and health fields to benefit more people.
(Web editor: Zhang Kaiwei, Zhong Wenxing)"
